{
  "path": "/docs/mdx/",
  "result": {
    "data": {
      "mdx": {
        "body": "function _extends() { _extends = Object.assign || function (target) { for (var i = 1; i < arguments.length; i++) { var source = arguments[i]; for (var key in source) { if (Object.prototype.hasOwnProperty.call(source, key)) { target[key] = source[key]; } } } return target; }; return _extends.apply(this, arguments); }\n\nfunction _objectWithoutProperties(source, excluded) { if (source == null) return {}; var target = _objectWithoutPropertiesLoose(source, excluded); var key, i; if (Object.getOwnPropertySymbols) { var sourceSymbolKeys = Object.getOwnPropertySymbols(source); for (i = 0; i < sourceSymbolKeys.length; i++) { key = sourceSymbolKeys[i]; if (excluded.indexOf(key) >= 0) continue; if (!Object.prototype.propertyIsEnumerable.call(source, key)) continue; target[key] = source[key]; } } return target; }\n\nfunction _objectWithoutPropertiesLoose(source, excluded) { if (source == null) return {}; var target = {}; var sourceKeys = Object.keys(source); var key, i; for (i = 0; i < sourceKeys.length; i++) { key = sourceKeys[i]; if (excluded.indexOf(key) >= 0) continue; target[key] = source[key]; } return target; }\n\n/* @jsx mdx */\nvar _frontmatter = {\n  \"title\": \"Adding Components to Markdown with MDX\"\n};\n\nvar makeShortcode = function makeShortcode(name) {\n  return function MDXDefaultShortcode(props) {\n    console.warn(\"Component \" + name + \" was not imported, exported, or provided by MDXProvider as global scope\");\n    return mdx(\"div\", props);\n  };\n};\n\nvar layoutProps = {\n  _frontmatter: _frontmatter\n};\nvar MDXLayout = \"wrapper\";\nreturn function MDXContent(_ref) {\n  var components = _ref.components,\n      props = _objectWithoutProperties(_ref, [\"components\"]);\n\n  return mdx(MDXLayout, _extends({}, layoutProps, props, {\n    components: components,\n    mdxType: \"MDXLayout\"\n  }), mdx(\"p\", null, \"When writing long-form content in Markdown you might want to embed \", mdx(\"a\", _extends({\n    parentName: \"p\"\n  }, {\n    \"href\": \"/docs/glossary/#component\"\n  }), \"components\"), \".\\nThis is often achieved by either writing content in JSX or using plugins that\\nuse custom syntax. The first approach isn\\u2019t optimal because JSX isn\\u2019t the best\\nformat for content and can make it less approachable to members of a team. Custom\\nsyntax and plugins are often too inflexible and don\\u2019t promote composition. If\\nyou\\u2019re finding yourself wanting to add components to your content you can use\\n\", mdx(\"inlineCode\", {\n    parentName: \"p\"\n  }, \"gatsby-plugin-mdx\"), \" which is a Gatsby plugin to integrate MDX into your project.\"), mdx(\"h2\", {\n    \"id\": \"whats-mdx\"\n  }, mdx(\"a\", _extends({\n    parentName: \"h2\"\n  }, {\n    \"href\": \"#whats-mdx\",\n    \"aria-label\": \"whats mdx permalink\",\n    \"className\": \"anchor\"\n  }), mdx(\"svg\", _extends({\n    parentName: \"a\"\n  }, {\n    \"aria-hidden\": \"true\",\n    \"focusable\": \"false\",\n    \"height\": \"16\",\n    \"version\": \"1.1\",\n    \"viewBox\": \"0 0 16 16\",\n    \"width\": \"16\"\n  }), mdx(\"path\", _extends({\n    parentName: \"svg\"\n  }, {\n    \"fillRule\": \"evenodd\",\n    \"d\": \"M4 9h1v1H4c-1.5 0-3-1.69-3-3.5S2.55 3 4 3h4c1.45 0 3 1.69 3 3.5 0 1.41-.91 2.72-2 3.25V8.59c.58-.45 1-1.27 1-2.09C10 5.22 8.98 4 8 4H4c-.98 0-2 1.22-2 2.5S3 9 4 9zm9-3h-1v1h1c1 0 2 1.22 2 2.5S13.98 12 13 12H9c-.98 0-2-1.22-2-2.5 0-.83.42-1.64 1-2.09V6.25c-1.09.53-2 1.84-2 3.25C6 11.31 7.55 13 9 13h4c1.45 0 3-1.69 3-3.5S14.5 6 13 6z\"\n  })))), \"What\\u2019s MDX?\"), mdx(\"p\", null, mdx(\"a\", _extends({\n    parentName: \"p\"\n  }, {\n    \"href\": \"https://mdxjs.com\"\n  }), \"MDX\"), \" is Markdown for the component era.\\nIt lets you write JSX embedded inside Markdown.\\nIt\\u2019s a great combination because it allows you to use Markdown\\u2019s terse\\nsyntax (such as \", mdx(\"inlineCode\", {\n    parentName: \"p\"\n  }, \"# Heading\"), \") for your content and JSX for more advanced,\\nor reusable components.\"), mdx(\"p\", null, \"This is useful in content-driven sites where you want the ability\\nto introduce components like charts or alerts without having to\\nconfigure a plugin. It emphasizes composition over configuration\\nand really shines with interactive blog posts, documenting design\\nsystems, or long form articles with immersive or dynamic\\ninteractions.\"), mdx(\"p\", null, \"When using MDX you can also import other MDX documents and render\\nthem as components. This lets you write something like an FAQ\\npage in one place and reuse it throughout your website.\"), mdx(\"h2\", {\n    \"id\": \"what-does-it-look-like-in-practice\"\n  }, mdx(\"a\", _extends({\n    parentName: \"h2\"\n  }, {\n    \"href\": \"#what-does-it-look-like-in-practice\",\n    \"aria-label\": \"what does it look like in practice permalink\",\n    \"className\": \"anchor\"\n  }), mdx(\"svg\", _extends({\n    parentName: \"a\"\n  }, {\n    \"aria-hidden\": \"true\",\n    \"focusable\": \"false\",\n    \"height\": \"16\",\n    \"version\": \"1.1\",\n    \"viewBox\": \"0 0 16 16\",\n    \"width\": \"16\"\n  }), mdx(\"path\", _extends({\n    parentName: \"svg\"\n  }, {\n    \"fillRule\": \"evenodd\",\n    \"d\": \"M4 9h1v1H4c-1.5 0-3-1.69-3-3.5S2.55 3 4 3h4c1.45 0 3 1.69 3 3.5 0 1.41-.91 2.72-2 3.25V8.59c.58-.45 1-1.27 1-2.09C10 5.22 8.98 4 8 4H4c-.98 0-2 1.22-2 2.5S3 9 4 9zm9-3h-1v1h1c1 0 2 1.22 2 2.5S13.98 12 13 12H9c-.98 0-2-1.22-2-2.5 0-.83.42-1.64 1-2.09V6.25c-1.09.53-2 1.84-2 3.25C6 11.31 7.55 13 9 13h4c1.45 0 3-1.69 3-3.5S14.5 6 13 6z\"\n  })))), \"What does it look like in practice?\"), mdx(\"p\", null, \"Importing and JSX syntax works just like it does in your components. This\\nresults in a seamless experience for developers and content authors alike.\\nMarkdown and JSX are included alongside each other like this:\"), mdx(\"pre\", null, mdx(\"code\", _extends({\n    parentName: \"pre\"\n  }, {\n    \"className\": \"language-md\"\n  }), \"import { Chart } from '../components/chart'\\n\\n# Here\\u2019s a chart\\n\\nThe chart is rendered inside our MDX document.\\n\\n<Chart />\\n\")), mdx(\"h2\", {\n    \"id\": \"features\"\n  }, mdx(\"a\", _extends({\n    parentName: \"h2\"\n  }, {\n    \"href\": \"#features\",\n    \"aria-label\": \"features permalink\",\n    \"className\": \"anchor\"\n  }), mdx(\"svg\", _extends({\n    parentName: \"a\"\n  }, {\n    \"aria-hidden\": \"true\",\n    \"focusable\": \"false\",\n    \"height\": \"16\",\n    \"version\": \"1.1\",\n    \"viewBox\": \"0 0 16 16\",\n    \"width\": \"16\"\n  }), mdx(\"path\", _extends({\n    parentName: \"svg\"\n  }, {\n    \"fillRule\": \"evenodd\",\n    \"d\": \"M4 9h1v1H4c-1.5 0-3-1.69-3-3.5S2.55 3 4 3h4c1.45 0 3 1.69 3 3.5 0 1.41-.91 2.72-2 3.25V8.59c.58-.45 1-1.27 1-2.09C10 5.22 8.98 4 8 4H4c-.98 0-2 1.22-2 2.5S3 9 4 9zm9-3h-1v1h1c1 0 2 1.22 2 2.5S13.98 12 13 12H9c-.98 0-2-1.22-2-2.5 0-.83.42-1.64 1-2.09V6.25c-1.09.53-2 1.84-2 3.25C6 11.31 7.55 13 9 13h4c1.45 0 3-1.69 3-3.5S14.5 6 13 6z\"\n  })))), \"Features\"), mdx(\"p\", null, \"\\u2764\\uFE0F \", mdx(\"strong\", {\n    parentName: \"p\"\n  }, \"Powerful\"), \": MDX blends Markdown and JSX syntax to fit perfectly in\\nReact/JSX-based projects.\"), mdx(\"p\", null, \"\\uD83D\\uDCBB \", mdx(\"strong\", {\n    parentName: \"p\"\n  }, \"Everything is a component\"), \": Use existing components inside your\\nMDX and import other MDX files as plain components.\"), mdx(\"p\", null, \"\\uD83D\\uDD27 \", mdx(\"strong\", {\n    parentName: \"p\"\n  }, \"Customizable\"), \": Decide which component is rendered for each Markdown\\nelement (\", mdx(\"inlineCode\", {\n    parentName: \"p\"\n  }, \"{ h1: MyHeading }\"), \").\"), mdx(\"p\", null, \"\\uD83D\\uDCDA \", mdx(\"strong\", {\n    parentName: \"p\"\n  }, \"Markdown-based\"), \": The simplicity and elegance of markdown remains;\\nyou interleave JSX only when you want to.\"), mdx(\"p\", null, \"\\uD83D\\uDD25 \", mdx(\"strong\", {\n    parentName: \"p\"\n  }, \"Blazingly blazing fast\"), \": MDX has no runtime, all compilation occurs\\nduring the build stage.\"), mdx(\"h2\", {\n    \"id\": \"guides-in-this-section\"\n  }, mdx(\"a\", _extends({\n    parentName: \"h2\"\n  }, {\n    \"href\": \"#guides-in-this-section\",\n    \"aria-label\": \"guides in this section permalink\",\n    \"className\": \"anchor\"\n  }), mdx(\"svg\", _extends({\n    parentName: \"a\"\n  }, {\n    \"aria-hidden\": \"true\",\n    \"focusable\": \"false\",\n    \"height\": \"16\",\n    \"version\": \"1.1\",\n    \"viewBox\": \"0 0 16 16\",\n    \"width\": \"16\"\n  }), mdx(\"path\", _extends({\n    parentName: \"svg\"\n  }, {\n    \"fillRule\": \"evenodd\",\n    \"d\": \"M4 9h1v1H4c-1.5 0-3-1.69-3-3.5S2.55 3 4 3h4c1.45 0 3 1.69 3 3.5 0 1.41-.91 2.72-2 3.25V8.59c.58-.45 1-1.27 1-2.09C10 5.22 8.98 4 8 4H4c-.98 0-2 1.22-2 2.5S3 9 4 9zm9-3h-1v1h1c1 0 2 1.22 2 2.5S13.98 12 13 12H9c-.98 0-2-1.22-2-2.5 0-.83.42-1.64 1-2.09V6.25c-1.09.53-2 1.84-2 3.25C6 11.31 7.55 13 9 13h4c1.45 0 3-1.69 3-3.5S14.5 6 13 6z\"\n  })))), \"Guides in this section\"), mdx(\"ul\", null, mdx(\"li\", {\n    parentName: \"ul\"\n  }, mdx(\"a\", _extends({\n    parentName: \"li\"\n  }, {\n    \"href\": \"/docs/mdx/getting-started\"\n  }), \"Getting started\")), mdx(\"li\", {\n    parentName: \"ul\"\n  }, mdx(\"a\", _extends({\n    parentName: \"li\"\n  }, {\n    \"href\": \"/docs/mdx/writing-pages\"\n  }), \"Writing pages in MDX\")), mdx(\"li\", {\n    parentName: \"ul\"\n  }, mdx(\"a\", _extends({\n    parentName: \"li\"\n  }, {\n    \"href\": \"/docs/mdx/customizing-components\"\n  }), \"Customizing components\")), mdx(\"li\", {\n    parentName: \"ul\"\n  }, mdx(\"a\", _extends({\n    parentName: \"li\"\n  }, {\n    \"href\": \"/docs/mdx/programmatically-creating-pages\"\n  }), \"Programmatically creating pages\")), mdx(\"li\", {\n    parentName: \"ul\"\n  }, mdx(\"a\", _extends({\n    parentName: \"li\"\n  }, {\n    \"href\": \"/docs/mdx/plugins\"\n  }), \"Using plugins\"))));\n}\n;\nMDXContent.isMDXComponent = true;",
        "excerpt": "When writing long-form content in Markdown you might want to embed  components .\nThis is often achieved by either writing content in JSX or…",
        "timeToRead": 1,
        "tableOfContents": {
          "items": [
            {
              "url": "#whats-mdx",
              "title": "What's MDX?"
            },
            {
              "url": "#what-does-it-look-like-in-practice",
              "title": "What does it look like in practice?"
            },
            {
              "url": "#features",
              "title": "Features"
            },
            {
              "url": "#guides-in-this-section",
              "title": "Guides in this section"
            }
          ]
        },
        "fields": {
          "slug": "/docs/mdx/",
          "anchor": "mdx"
        },
        "frontmatter": {
          "title": "Adding Components to Markdown with MDX",
          "overview": null,
          "issue": null,
          "disableTableOfContents": null,
          "tableOfContentsDepth": null
        },
        "parent": {
          "__typename": "File",
          "relativePath": "docs/mdx/index.md"
        }
      }
    },
    "pageContext": {
      "isCreatedByStatefulCreatePages": false,
      "slug": "/docs/mdx/",
      "prev": {
        "title": "Using Theme UI",
        "link": "/docs/theme-ui/"
      },
      "next": {
        "title": "Getting Started with MDX",
        "link": "/docs/mdx/getting-started/"
      }
    }
  },
  "query": "query usersMisiekDevGatsbyWwwSrcTemplatesTemplateDocsMarkdownJs2546709735(\n  $path: String!\n) {\n  mdx(fields: {slug: {eq: $path}}) {\n    body\n    excerpt\n    timeToRead\n    tableOfContents\n    fields {\n      slug\n      anchor\n    }\n    frontmatter {\n      title\n      overview\n      issue\n      disableTableOfContents\n      tableOfContentsDepth\n    }\n    ...MarkdownPageFooterMdx\n  }\n}\n\nfragment MarkdownPageFooterMdx on Mdx {\n  parent {\n    __typename\n    ... on File {\n      relativePath\n    }\n  }\n}\n"
}