{
  "path": "/docs/debugging-replace-renderer-api/",
  "result": {
    "data": {
      "mdx": {
        "body": "function _extends() { _extends = Object.assign || function (target) { for (var i = 1; i < arguments.length; i++) { var source = arguments[i]; for (var key in source) { if (Object.prototype.hasOwnProperty.call(source, key)) { target[key] = source[key]; } } } return target; }; return _extends.apply(this, arguments); }\n\nfunction _objectWithoutProperties(source, excluded) { if (source == null) return {}; var target = _objectWithoutPropertiesLoose(source, excluded); var key, i; if (Object.getOwnPropertySymbols) { var sourceSymbolKeys = Object.getOwnPropertySymbols(source); for (i = 0; i < sourceSymbolKeys.length; i++) { key = sourceSymbolKeys[i]; if (excluded.indexOf(key) >= 0) continue; if (!Object.prototype.propertyIsEnumerable.call(source, key)) continue; target[key] = source[key]; } } return target; }\n\nfunction _objectWithoutPropertiesLoose(source, excluded) { if (source == null) return {}; var target = {}; var sourceKeys = Object.keys(source); var key, i; for (i = 0; i < sourceKeys.length; i++) { key = sourceKeys[i]; if (excluded.indexOf(key) >= 0) continue; target[key] = source[key]; } return target; }\n\n/* @jsx mdx */\nvar _frontmatter = {\n  \"title\": \"Debugging replaceRenderer API\"\n};\n\nvar makeShortcode = function makeShortcode(name) {\n  return function MDXDefaultShortcode(props) {\n    console.warn(\"Component \" + name + \" was not imported, exported, or provided by MDXProvider as global scope\");\n    return mdx(\"div\", props);\n  };\n};\n\nvar layoutProps = {\n  _frontmatter: _frontmatter\n};\nvar MDXLayout = \"wrapper\";\nreturn function MDXContent(_ref) {\n  var components = _ref.components,\n      props = _objectWithoutProperties(_ref, [\"components\"]);\n\n  return mdx(MDXLayout, _extends({}, layoutProps, props, {\n    components: components,\n    mdxType: \"MDXLayout\"\n  }), mdx(\"h2\", {\n    \"id\": \"prerequisites\"\n  }, mdx(\"a\", _extends({\n    parentName: \"h2\"\n  }, {\n    \"href\": \"#prerequisites\",\n    \"aria-label\": \"prerequisites permalink\",\n    \"className\": \"anchor\"\n  }), mdx(\"svg\", _extends({\n    parentName: \"a\"\n  }, {\n    \"aria-hidden\": \"true\",\n    \"focusable\": \"false\",\n    \"height\": \"16\",\n    \"version\": \"1.1\",\n    \"viewBox\": \"0 0 16 16\",\n    \"width\": \"16\"\n  }), mdx(\"path\", _extends({\n    parentName: \"svg\"\n  }, {\n    \"fillRule\": \"evenodd\",\n    \"d\": \"M4 9h1v1H4c-1.5 0-3-1.69-3-3.5S2.55 3 4 3h4c1.45 0 3 1.69 3 3.5 0 1.41-.91 2.72-2 3.25V8.59c.58-.45 1-1.27 1-2.09C10 5.22 8.98 4 8 4H4c-.98 0-2 1.22-2 2.5S3 9 4 9zm9-3h-1v1h1c1 0 2 1.22 2 2.5S13.98 12 13 12H9c-.98 0-2-1.22-2-2.5 0-.83.42-1.64 1-2.09V6.25c-1.09.53-2 1.84-2 3.25C6 11.31 7.55 13 9 13h4c1.45 0 3-1.69 3-3.5S14.5 6 13 6z\"\n  })))), \"Prerequisites\"), mdx(\"p\", null, \"If you\\u2019re not familiar with Gatsby\\u2019s lifecycle, see the overview \", mdx(\"a\", _extends({\n    parentName: \"p\"\n  }, {\n    \"href\": \"/docs/gatsby-lifecycle-apis/\"\n  }), \"Gatsby Lifecycle APIs\"), \".\"), mdx(\"h2\", {\n    \"id\": \"what-is-the-replacerenderer-api\"\n  }, mdx(\"a\", _extends({\n    parentName: \"h2\"\n  }, {\n    \"href\": \"#what-is-the-replacerenderer-api\",\n    \"aria-label\": \"what is the replacerenderer api permalink\",\n    \"className\": \"anchor\"\n  }), mdx(\"svg\", _extends({\n    parentName: \"a\"\n  }, {\n    \"aria-hidden\": \"true\",\n    \"focusable\": \"false\",\n    \"height\": \"16\",\n    \"version\": \"1.1\",\n    \"viewBox\": \"0 0 16 16\",\n    \"width\": \"16\"\n  }), mdx(\"path\", _extends({\n    parentName: \"svg\"\n  }, {\n    \"fillRule\": \"evenodd\",\n    \"d\": \"M4 9h1v1H4c-1.5 0-3-1.69-3-3.5S2.55 3 4 3h4c1.45 0 3 1.69 3 3.5 0 1.41-.91 2.72-2 3.25V8.59c.58-.45 1-1.27 1-2.09C10 5.22 8.98 4 8 4H4c-.98 0-2 1.22-2 2.5S3 9 4 9zm9-3h-1v1h1c1 0 2 1.22 2 2.5S13.98 12 13 12H9c-.98 0-2-1.22-2-2.5 0-.83.42-1.64 1-2.09V6.25c-1.09.53-2 1.84-2 3.25C6 11.31 7.55 13 9 13h4c1.45 0 3-1.69 3-3.5S14.5 6 13 6z\"\n  })))), \"What is the \", mdx(\"inlineCode\", {\n    parentName: \"h2\"\n  }, \"replaceRenderer\"), \" API?\"), mdx(\"p\", null, \"The \", mdx(\"inlineCode\", {\n    parentName: \"p\"\n  }, \"replaceRenderer\"), \" API is one of \", mdx(\"a\", _extends({\n    parentName: \"p\"\n  }, {\n    \"href\": \"/docs/ssr-apis/#replaceRenderer\"\n  }), \"Gatsby\\u2019s Server Side Rendering (SSR) extension APIs\"), \". This API is called when you run \", mdx(\"inlineCode\", {\n    parentName: \"p\"\n  }, \"gatsby build\"), \" and is used to customise how Gatsby renders your static content. It can be implemented by any Gatsby plugin or your \", mdx(\"inlineCode\", {\n    parentName: \"p\"\n  }, \"gatsby-ssr.js\"), \" file - adding support for Redux, CSS-in-JS libraries or any code that needs to change Gatsby\\u2019s default HTML output.\"), mdx(\"h2\", {\n    \"id\": \"why-does-it-cause-build-errors\"\n  }, mdx(\"a\", _extends({\n    parentName: \"h2\"\n  }, {\n    \"href\": \"#why-does-it-cause-build-errors\",\n    \"aria-label\": \"why does it cause build errors permalink\",\n    \"className\": \"anchor\"\n  }), mdx(\"svg\", _extends({\n    parentName: \"a\"\n  }, {\n    \"aria-hidden\": \"true\",\n    \"focusable\": \"false\",\n    \"height\": \"16\",\n    \"version\": \"1.1\",\n    \"viewBox\": \"0 0 16 16\",\n    \"width\": \"16\"\n  }), mdx(\"path\", _extends({\n    parentName: \"svg\"\n  }, {\n    \"fillRule\": \"evenodd\",\n    \"d\": \"M4 9h1v1H4c-1.5 0-3-1.69-3-3.5S2.55 3 4 3h4c1.45 0 3 1.69 3 3.5 0 1.41-.91 2.72-2 3.25V8.59c.58-.45 1-1.27 1-2.09C10 5.22 8.98 4 8 4H4c-.98 0-2 1.22-2 2.5S3 9 4 9zm9-3h-1v1h1c1 0 2 1.22 2 2.5S13.98 12 13 12H9c-.98 0-2-1.22-2-2.5 0-.83.42-1.64 1-2.09V6.25c-1.09.53-2 1.84-2 3.25C6 11.31 7.55 13 9 13h4c1.45 0 3-1.69 3-3.5S14.5 6 13 6z\"\n  })))), \"Why does it cause build errors?\"), mdx(\"p\", null, \"If multiple plugins implement \", mdx(\"inlineCode\", {\n    parentName: \"p\"\n  }, \"replaceRenderer\"), \" in your project, only the last plugin implementing the API can be called - which will break your site builds.\"), mdx(\"p\", null, \"Note that \", mdx(\"inlineCode\", {\n    parentName: \"p\"\n  }, \"replaceRenderer\"), \" is only used during the build lifecycle. It won\\u2019t cause problems as you work on your site with the develop script.\"), mdx(\"p\", null, \"If multiple plugins implement \", mdx(\"inlineCode\", {\n    parentName: \"p\"\n  }, \"replaceRenderer\"), \", the build script will warn you:\"), mdx(\"pre\", null, mdx(\"code\", _extends({\n    parentName: \"pre\"\n  }, {}), \"warning replaceRenderer API found in these plugins:\\nwarning plugin-name-a, default-site-plugin\\nwarning This might be an error, see: https://www.gatsbyjs.org/docs/debugging-replace-renderer-api/\\n\\nwarning Duplicate replaceRenderer found, skipping gatsby-ssr.js for plugin: plugin-name-a\\n\")), mdx(\"p\", null, \"Note that \", mdx(\"inlineCode\", {\n    parentName: \"p\"\n  }, \"default-site-plugin\"), \" refers to your local \", mdx(\"inlineCode\", {\n    parentName: \"p\"\n  }, \"gatsby-ssr.js\"), \" file, if this file exists it will always be used in favor of \", mdx(\"inlineCode\", {\n    parentName: \"p\"\n  }, \"gatsby-ssr.js\"), \" from other plugins.\"), mdx(\"h2\", {\n    \"id\": \"fixing-replacerenderer-build-errors\"\n  }, mdx(\"a\", _extends({\n    parentName: \"h2\"\n  }, {\n    \"href\": \"#fixing-replacerenderer-build-errors\",\n    \"aria-label\": \"fixing replacerenderer build errors permalink\",\n    \"className\": \"anchor\"\n  }), mdx(\"svg\", _extends({\n    parentName: \"a\"\n  }, {\n    \"aria-hidden\": \"true\",\n    \"focusable\": \"false\",\n    \"height\": \"16\",\n    \"version\": \"1.1\",\n    \"viewBox\": \"0 0 16 16\",\n    \"width\": \"16\"\n  }), mdx(\"path\", _extends({\n    parentName: \"svg\"\n  }, {\n    \"fillRule\": \"evenodd\",\n    \"d\": \"M4 9h1v1H4c-1.5 0-3-1.69-3-3.5S2.55 3 4 3h4c1.45 0 3 1.69 3 3.5 0 1.41-.91 2.72-2 3.25V8.59c.58-.45 1-1.27 1-2.09C10 5.22 8.98 4 8 4H4c-.98 0-2 1.22-2 2.5S3 9 4 9zm9-3h-1v1h1c1 0 2 1.22 2 2.5S13.98 12 13 12H9c-.98 0-2-1.22-2-2.5 0-.83.42-1.64 1-2.09V6.25c-1.09.53-2 1.84-2 3.25C6 11.31 7.55 13 9 13h4c1.45 0 3-1.69 3-3.5S14.5 6 13 6z\"\n  })))), \"Fixing \", mdx(\"inlineCode\", {\n    parentName: \"h2\"\n  }, \"replaceRenderer\"), \" build errors\"), mdx(\"p\", null, \"If you see errors during your build, you can fix them with the following steps.\"), mdx(\"h3\", {\n    \"id\": \"1-identify-the-plugins-using-replacerenderer\"\n  }, mdx(\"a\", _extends({\n    parentName: \"h3\"\n  }, {\n    \"href\": \"#1-identify-the-plugins-using-replacerenderer\",\n    \"aria-label\": \"1 identify the plugins using replacerenderer permalink\",\n    \"className\": \"anchor\"\n  }), mdx(\"svg\", _extends({\n    parentName: \"a\"\n  }, {\n    \"aria-hidden\": \"true\",\n    \"focusable\": \"false\",\n    \"height\": \"16\",\n    \"version\": \"1.1\",\n    \"viewBox\": \"0 0 16 16\",\n    \"width\": \"16\"\n  }), mdx(\"path\", _extends({\n    parentName: \"svg\"\n  }, {\n    \"fillRule\": \"evenodd\",\n    \"d\": \"M4 9h1v1H4c-1.5 0-3-1.69-3-3.5S2.55 3 4 3h4c1.45 0 3 1.69 3 3.5 0 1.41-.91 2.72-2 3.25V8.59c.58-.45 1-1.27 1-2.09C10 5.22 8.98 4 8 4H4c-.98 0-2 1.22-2 2.5S3 9 4 9zm9-3h-1v1h1c1 0 2 1.22 2 2.5S13.98 12 13 12H9c-.98 0-2-1.22-2-2.5 0-.83.42-1.64 1-2.09V6.25c-1.09.53-2 1.84-2 3.25C6 11.31 7.55 13 9 13h4c1.45 0 3-1.69 3-3.5S14.5 6 13 6z\"\n  })))), \"1. Identify the plugins using \", mdx(\"inlineCode\", {\n    parentName: \"h3\"\n  }, \"replaceRenderer\")), mdx(\"p\", null, \"Your error message should list which plugins implement \", mdx(\"inlineCode\", {\n    parentName: \"p\"\n  }, \"replaceRenderer\"), \":\"), mdx(\"pre\", null, mdx(\"code\", _extends({\n    parentName: \"pre\"\n  }, {\n    \"className\": \"language-shell\"\n  }), \"warning replaceRenderer API found in these plugins:\\nwarning plugin-name-a, default-site-plugin\\n\")), mdx(\"p\", null, \"In this example, your \", mdx(\"inlineCode\", {\n    parentName: \"p\"\n  }, \"gatsby-ssr.js\"), \" file and \", mdx(\"inlineCode\", {\n    parentName: \"p\"\n  }, \"plugin-name-a\"), \" are both using \", mdx(\"inlineCode\", {\n    parentName: \"p\"\n  }, \"replaceRenderer\"), \".\"), mdx(\"h3\", {\n    \"id\": \"2-copy-the-plugins-replacerenderer-functionality-to-your-sites-gatsby-ssrjs-file\"\n  }, mdx(\"a\", _extends({\n    parentName: \"h3\"\n  }, {\n    \"href\": \"#2-copy-the-plugins-replacerenderer-functionality-to-your-sites-gatsby-ssrjs-file\",\n    \"aria-label\": \"2 copy the plugins replacerenderer functionality to your sites gatsby ssrjs file permalink\",\n    \"className\": \"anchor\"\n  }), mdx(\"svg\", _extends({\n    parentName: \"a\"\n  }, {\n    \"aria-hidden\": \"true\",\n    \"focusable\": \"false\",\n    \"height\": \"16\",\n    \"version\": \"1.1\",\n    \"viewBox\": \"0 0 16 16\",\n    \"width\": \"16\"\n  }), mdx(\"path\", _extends({\n    parentName: \"svg\"\n  }, {\n    \"fillRule\": \"evenodd\",\n    \"d\": \"M4 9h1v1H4c-1.5 0-3-1.69-3-3.5S2.55 3 4 3h4c1.45 0 3 1.69 3 3.5 0 1.41-.91 2.72-2 3.25V8.59c.58-.45 1-1.27 1-2.09C10 5.22 8.98 4 8 4H4c-.98 0-2 1.22-2 2.5S3 9 4 9zm9-3h-1v1h1c1 0 2 1.22 2 2.5S13.98 12 13 12H9c-.98 0-2-1.22-2-2.5 0-.83.42-1.64 1-2.09V6.25c-1.09.53-2 1.84-2 3.25C6 11.31 7.55 13 9 13h4c1.45 0 3-1.69 3-3.5S14.5 6 13 6z\"\n  })))), \"2. Copy the plugins\\u2019 \", mdx(\"inlineCode\", {\n    parentName: \"h3\"\n  }, \"replaceRenderer\"), \" functionality to your site\\u2019s \", mdx(\"inlineCode\", {\n    parentName: \"h3\"\n  }, \"gatsby-ssr.js\"), \" file\"), mdx(\"p\", null, \"You\\u2019ll need to override your plugins\\u2019 \", mdx(\"inlineCode\", {\n    parentName: \"p\"\n  }, \"replaceRenderer\"), \" code in your \", mdx(\"inlineCode\", {\n    parentName: \"p\"\n  }, \"gatsby-ssr.js\"), \" file. This step will be different for each project, keep reading to see an example.\"), mdx(\"h2\", {\n    \"id\": \"example\"\n  }, mdx(\"a\", _extends({\n    parentName: \"h2\"\n  }, {\n    \"href\": \"#example\",\n    \"aria-label\": \"example permalink\",\n    \"className\": \"anchor\"\n  }), mdx(\"svg\", _extends({\n    parentName: \"a\"\n  }, {\n    \"aria-hidden\": \"true\",\n    \"focusable\": \"false\",\n    \"height\": \"16\",\n    \"version\": \"1.1\",\n    \"viewBox\": \"0 0 16 16\",\n    \"width\": \"16\"\n  }), mdx(\"path\", _extends({\n    parentName: \"svg\"\n  }, {\n    \"fillRule\": \"evenodd\",\n    \"d\": \"M4 9h1v1H4c-1.5 0-3-1.69-3-3.5S2.55 3 4 3h4c1.45 0 3 1.69 3 3.5 0 1.41-.91 2.72-2 3.25V8.59c.58-.45 1-1.27 1-2.09C10 5.22 8.98 4 8 4H4c-.98 0-2 1.22-2 2.5S3 9 4 9zm9-3h-1v1h1c1 0 2 1.22 2 2.5S13.98 12 13 12H9c-.98 0-2-1.22-2-2.5 0-.83.42-1.64 1-2.09V6.25c-1.09.53-2 1.84-2 3.25C6 11.31 7.55 13 9 13h4c1.45 0 3-1.69 3-3.5S14.5 6 13 6z\"\n  })))), \"Example\"), mdx(\"h3\", {\n    \"id\": \"initial-setup\"\n  }, mdx(\"a\", _extends({\n    parentName: \"h3\"\n  }, {\n    \"href\": \"#initial-setup\",\n    \"aria-label\": \"initial setup permalink\",\n    \"className\": \"anchor\"\n  }), mdx(\"svg\", _extends({\n    parentName: \"a\"\n  }, {\n    \"aria-hidden\": \"true\",\n    \"focusable\": \"false\",\n    \"height\": \"16\",\n    \"version\": \"1.1\",\n    \"viewBox\": \"0 0 16 16\",\n    \"width\": \"16\"\n  }), mdx(\"path\", _extends({\n    parentName: \"svg\"\n  }, {\n    \"fillRule\": \"evenodd\",\n    \"d\": \"M4 9h1v1H4c-1.5 0-3-1.69-3-3.5S2.55 3 4 3h4c1.45 0 3 1.69 3 3.5 0 1.41-.91 2.72-2 3.25V8.59c.58-.45 1-1.27 1-2.09C10 5.22 8.98 4 8 4H4c-.98 0-2 1.22-2 2.5S3 9 4 9zm9-3h-1v1h1c1 0 2 1.22 2 2.5S13.98 12 13 12H9c-.98 0-2-1.22-2-2.5 0-.83.42-1.64 1-2.09V6.25c-1.09.53-2 1.84-2 3.25C6 11.31 7.55 13 9 13h4c1.45 0 3-1.69 3-3.5S14.5 6 13 6z\"\n  })))), \"Initial setup\"), mdx(\"p\", null, \"In this example project we\\u2019re using \", mdx(\"a\", _extends({\n    parentName: \"p\"\n  }, {\n    \"href\": \"https://github.com/gatsbyjs/gatsby/tree/master/examples/using-redux\"\n  }), mdx(\"inlineCode\", {\n    parentName: \"a\"\n  }, \"redux\")), \" and \", mdx(\"a\", _extends({\n    parentName: \"p\"\n  }, {\n    \"href\": \"https://github.com/gatsbyjs/gatsby/tree/master/packages/gatsby-plugin-styled-components\"\n  }), \"Gatsby\\u2019s Styled Components plugin\"), \".\"), mdx(\"pre\", null, mdx(\"code\", _extends({\n    parentName: \"pre\"\n  }, {\n    \"className\": \"language-js:title=gatsby-config.js\"\n  }), \"module.exports = {\\n  plugins: [`gatsby-plugin-styled-components`],\\n}\\n\")), mdx(\"p\", null, mdx(\"inlineCode\", {\n    parentName: \"p\"\n  }, \"gatsby-ssr.js\"), \" (based on the \", mdx(\"a\", _extends({\n    parentName: \"p\"\n  }, {\n    \"href\": \"https://github.com/gatsbyjs/gatsby/blob/master/examples/using-redux/gatsby-ssr.js\"\n  }), \"using Redux example\"), \")\"), mdx(\"pre\", null, mdx(\"code\", _extends({\n    parentName: \"pre\"\n  }, {\n    \"className\": \"language-js:title=gatsby-ssr.js\"\n  }), \"import React from \\\"react\\\"\\nimport { Provider } from \\\"react-redux\\\"\\nimport { renderToString } from \\\"react-dom/server\\\"\\n\\nimport createStore from \\\"./src/state/createStore\\\"\\n\\nexports.replaceRenderer = ({ bodyComponent, replaceBodyHTMLString }) => {\\n  const store = createStore()\\n\\n  const ConnectedBody = () => <Provider store={store}>{bodyComponent}</Provider>\\n  replaceBodyHTMLString(renderToString(<ConnectedBody />))\\n}\\n\")), mdx(\"p\", null, \"Note that the Styled Components plugin uses \", mdx(\"inlineCode\", {\n    parentName: \"p\"\n  }, \"replaceRenderer\"), \", and the code in \", mdx(\"inlineCode\", {\n    parentName: \"p\"\n  }, \"gatsby-ssr.js\"), \" also uses \", mdx(\"inlineCode\", {\n    parentName: \"p\"\n  }, \"replaceRenderer\"), \".\"), mdx(\"h3\", {\n    \"id\": \"fixing-the-replacerenderer-error\"\n  }, mdx(\"a\", _extends({\n    parentName: \"h3\"\n  }, {\n    \"href\": \"#fixing-the-replacerenderer-error\",\n    \"aria-label\": \"fixing the replacerenderer error permalink\",\n    \"className\": \"anchor\"\n  }), mdx(\"svg\", _extends({\n    parentName: \"a\"\n  }, {\n    \"aria-hidden\": \"true\",\n    \"focusable\": \"false\",\n    \"height\": \"16\",\n    \"version\": \"1.1\",\n    \"viewBox\": \"0 0 16 16\",\n    \"width\": \"16\"\n  }), mdx(\"path\", _extends({\n    parentName: \"svg\"\n  }, {\n    \"fillRule\": \"evenodd\",\n    \"d\": \"M4 9h1v1H4c-1.5 0-3-1.69-3-3.5S2.55 3 4 3h4c1.45 0 3 1.69 3 3.5 0 1.41-.91 2.72-2 3.25V8.59c.58-.45 1-1.27 1-2.09C10 5.22 8.98 4 8 4H4c-.98 0-2 1.22-2 2.5S3 9 4 9zm9-3h-1v1h1c1 0 2 1.22 2 2.5S13.98 12 13 12H9c-.98 0-2-1.22-2-2.5 0-.83.42-1.64 1-2.09V6.25c-1.09.53-2 1.84-2 3.25C6 11.31 7.55 13 9 13h4c1.45 0 3-1.69 3-3.5S14.5 6 13 6z\"\n  })))), \"Fixing the \", mdx(\"inlineCode\", {\n    parentName: \"h3\"\n  }, \"replaceRenderer\"), \" error\"), mdx(\"p\", null, \"Our \", mdx(\"inlineCode\", {\n    parentName: \"p\"\n  }, \"gatsby-config.js\"), \" file will remain unchanged. However, our \", mdx(\"inlineCode\", {\n    parentName: \"p\"\n  }, \"gatsby-ssr.js\"), \" file will update to include the \", mdx(\"a\", _extends({\n    parentName: \"p\"\n  }, {\n    \"href\": \"https://github.com/gatsbyjs/gatsby/blob/master/packages/gatsby-plugin-styled-components/src/gatsby-ssr.js\"\n  }), mdx(\"inlineCode\", {\n    parentName: \"a\"\n  }, \"replaceRenderer\"), \" functionality from the Styled Components plugin\")), mdx(\"pre\", null, mdx(\"code\", _extends({\n    parentName: \"pre\"\n  }, {\n    \"className\": \"language-js:title=gatsby-ssr.js\"\n  }), \"import React from \\\"react\\\"\\nimport { Provider } from \\\"react-redux\\\"\\nimport { renderToString } from \\\"react-dom/server\\\"\\nimport { ServerStyleSheet, StyleSheetManager } from \\\"styled-components\\\"\\nimport createStore from \\\"./src/state/createStore\\\"\\n\\nexports.replaceRenderer = ({\\n  bodyComponent,\\n  replaceBodyHTMLString,\\n  setHeadComponents,\\n}) => {\\n  const sheet = new ServerStyleSheet()\\n  const store = createStore()\\n\\n  const app = () => (\\n    <Provider store={store}>\\n      <StyleSheetManager sheet={sheet.instance}>\\n        {bodyComponent}\\n      </StyleSheetManager>\\n    </Provider>\\n  )\\n  replaceBodyHTMLString(renderToString(<app />))\\n  setHeadComponents([sheet.getStyleElement()])\\n}\\n\")), mdx(\"p\", null, \"Now \", mdx(\"inlineCode\", {\n    parentName: \"p\"\n  }, \"gatsby-ssr.js\"), \" implements the Styled Components and Redux functionality using one \", mdx(\"inlineCode\", {\n    parentName: \"p\"\n  }, \"replaceRenderer\"), \" instance. Run \", mdx(\"inlineCode\", {\n    parentName: \"p\"\n  }, \"npm run build\"), \" and the site will build correctly.\"), mdx(\"p\", null, \"All the code from this example is \", mdx(\"a\", _extends({\n    parentName: \"p\"\n  }, {\n    \"href\": \"https://github.com/m-allanson/gatsby-replace-renderer-example/commits/master\"\n  }), \"available on GitHub\"), \".\"));\n}\n;\nMDXContent.isMDXComponent = true;",
        "excerpt": "Prerequisites If you’re not familiar with Gatsby’s lifecycle, see the overview  Gatsby Lifecycle APIs . What is the  replaceRenderer  API…",
        "timeToRead": 1,
        "tableOfContents": {
          "items": [
            {
              "url": "#prerequisites",
              "title": "Prerequisites"
            },
            {
              "url": "#what-is-the-replacerenderer-api",
              "title": "What is the replaceRenderer API?"
            },
            {
              "url": "#why-does-it-cause-build-errors",
              "title": "Why does it cause build errors?"
            },
            {
              "url": "#fixing-replacerenderer-build-errors",
              "title": "Fixing replaceRenderer build errors",
              "items": [
                {
                  "url": "#1-identify-the-plugins-using-replacerenderer",
                  "title": "1. Identify the plugins using replaceRenderer"
                },
                {
                  "url": "#2-copy-the-plugins-replacerenderer-functionality-to-your-sites-gatsby-ssrjs-file",
                  "title": "2. Copy the plugins' replaceRenderer functionality to your site's gatsby-ssr.js file"
                }
              ]
            },
            {
              "url": "#example",
              "title": "Example",
              "items": [
                {
                  "url": "#initial-setup",
                  "title": "Initial setup"
                },
                {
                  "url": "#fixing-the-replacerenderer-error",
                  "title": "Fixing the replaceRenderer error"
                }
              ]
            }
          ]
        },
        "fields": {
          "slug": "/docs/debugging-replace-renderer-api/",
          "anchor": "debugging-replace-renderer-api"
        },
        "frontmatter": {
          "title": "Debugging replaceRenderer API",
          "overview": null,
          "issue": null,
          "disableTableOfContents": null,
          "tableOfContentsDepth": null
        },
        "parent": {
          "__typename": "File",
          "relativePath": "docs/debugging-replace-renderer-api.md"
        }
      }
    },
    "pageContext": {
      "isCreatedByStatefulCreatePages": false,
      "slug": "/docs/debugging-replace-renderer-api/",
      "prev": {
        "title": "Debugging HTML Builds",
        "link": "/docs/debugging-html-builds/",
        "breadcrumbTitle": "HTML Builds"
      },
      "next": {
        "title": "Debugging the Build Process",
        "link": "/docs/debugging-the-build-process/",
        "breadcrumbTitle": "The Build Process"
      }
    }
  },
  "query": "query usersMisiekDevGatsbyWwwSrcTemplatesTemplateDocsMarkdownJs2546709735(\n  $path: String!\n) {\n  mdx(fields: {slug: {eq: $path}}) {\n    body\n    excerpt\n    timeToRead\n    tableOfContents\n    fields {\n      slug\n      anchor\n    }\n    frontmatter {\n      title\n      overview\n      issue\n      disableTableOfContents\n      tableOfContentsDepth\n    }\n    ...MarkdownPageFooterMdx\n  }\n}\n\nfragment MarkdownPageFooterMdx on Mdx {\n  parent {\n    __typename\n    ... on File {\n      relativePath\n    }\n  }\n}\n"
}