{
  "path": "/contributing/community/",
  "result": {
    "data": {
      "mdx": {
        "body": "function _extends() { _extends = Object.assign || function (target) { for (var i = 1; i < arguments.length; i++) { var source = arguments[i]; for (var key in source) { if (Object.prototype.hasOwnProperty.call(source, key)) { target[key] = source[key]; } } } return target; }; return _extends.apply(this, arguments); }\n\nfunction _objectWithoutProperties(source, excluded) { if (source == null) return {}; var target = _objectWithoutPropertiesLoose(source, excluded); var key, i; if (Object.getOwnPropertySymbols) { var sourceSymbolKeys = Object.getOwnPropertySymbols(source); for (i = 0; i < sourceSymbolKeys.length; i++) { key = sourceSymbolKeys[i]; if (excluded.indexOf(key) >= 0) continue; if (!Object.prototype.propertyIsEnumerable.call(source, key)) continue; target[key] = source[key]; } } return target; }\n\nfunction _objectWithoutPropertiesLoose(source, excluded) { if (source == null) return {}; var target = {}; var sourceKeys = Object.keys(source); var key, i; for (i = 0; i < sourceKeys.length; i++) { key = sourceKeys[i]; if (excluded.indexOf(key) >= 0) continue; target[key] = source[key]; } return target; }\n\n/* @jsx mdx */\nvar _frontmatter = {\n  \"title\": \"Community\"\n};\n\nvar makeShortcode = function makeShortcode(name) {\n  return function MDXDefaultShortcode(props) {\n    console.warn(\"Component \" + name + \" was not imported, exported, or provided by MDXProvider as global scope\");\n    return mdx(\"div\", props);\n  };\n};\n\nvar layoutProps = {\n  _frontmatter: _frontmatter\n};\nvar MDXLayout = \"wrapper\";\nreturn function MDXContent(_ref) {\n  var components = _ref.components,\n      props = _objectWithoutProperties(_ref, [\"components\"]);\n\n  return mdx(MDXLayout, _extends({}, layoutProps, props, {\n    components: components,\n    mdxType: \"MDXLayout\"\n  }), mdx(\"p\", null, \"As of March 2019, the Gatsby community is comprised of over 1,800 contributors and tens of thousands of developers building both personal and commercial websites on Gatsby.\"), mdx(\"p\", null, \"Open source doesn\\u2019t always have the best reputation for being friendly and welcoming, and that makes us sad. \", mdx(\"strong\", {\n    parentName: \"p\"\n  }, \"Everyone belongs in open source, and Gatsby is dedicated to making you feel welcome.\")), mdx(\"p\", null, \"We will never judge, condescend, or exclude anyone. Instead, we will go above and beyond to support the community, through helping you contribute to the Gatsby ecosystem, offering \", mdx(\"a\", _extends({\n    parentName: \"p\"\n  }, {\n    \"href\": \"https://gatsby.dev/swag\"\n  }), \"free swag for contributors\"), \", giving control to the community by \", mdx(\"a\", _extends({\n    parentName: \"p\"\n  }, {\n    \"href\": \"https://github.com/gatsbyjs/gatsby/pull/7699#issuecomment-416665803\"\n  }), \"auto-inviting all contributors to the Gatsby GitHub org\"), \", an open and inclusive \", mdx(\"a\", _extends({\n    parentName: \"p\"\n  }, {\n    \"href\": \"/contributing/code-of-conduct/\"\n  }), \"code of conduct\"), \", and other means that empower and embrace the incredible community that makes Gatsby possible.\"), mdx(\"p\", null, \"One of our community\\u2019s values is that \", mdx(\"a\", _extends({\n    parentName: \"p\"\n  }, {\n    \"href\": \"/blog/2018-09-07-gatsby-values/#you-belong-here\"\n  }), \"\\u201Cyou belong here\\u201D\"), \".\"), mdx(\"h2\", {\n    \"id\": \"gatsby-contributor-covenant-code-of-conduct\"\n  }, mdx(\"a\", _extends({\n    parentName: \"h2\"\n  }, {\n    \"href\": \"#gatsby-contributor-covenant-code-of-conduct\",\n    \"aria-label\": \"gatsby contributor covenant code of conduct permalink\",\n    \"className\": \"anchor\"\n  }), mdx(\"svg\", _extends({\n    parentName: \"a\"\n  }, {\n    \"aria-hidden\": \"true\",\n    \"focusable\": \"false\",\n    \"height\": \"16\",\n    \"version\": \"1.1\",\n    \"viewBox\": \"0 0 16 16\",\n    \"width\": \"16\"\n  }), mdx(\"path\", _extends({\n    parentName: \"svg\"\n  }, {\n    \"fillRule\": \"evenodd\",\n    \"d\": \"M4 9h1v1H4c-1.5 0-3-1.69-3-3.5S2.55 3 4 3h4c1.45 0 3 1.69 3 3.5 0 1.41-.91 2.72-2 3.25V8.59c.58-.45 1-1.27 1-2.09C10 5.22 8.98 4 8 4H4c-.98 0-2 1.22-2 2.5S3 9 4 9zm9-3h-1v1h1c1 0 2 1.22 2 2.5S13.98 12 13 12H9c-.98 0-2-1.22-2-2.5 0-.83.42-1.64 1-2.09V6.25c-1.09.53-2 1.84-2 3.25C6 11.31 7.55 13 9 13h4c1.45 0 3-1.69 3-3.5S14.5 6 13 6z\"\n  })))), \"Gatsby Contributor Covenant Code of Conduct\"), mdx(\"p\", null, \"In the interest of fostering an open and welcoming environment, we as\\ncontributors and maintainers pledge to making participation in our project and\\nour community a harassment-free experience for everyone, regardless of age, body\\nsize, disability, ethnicity, gender identity and expression, level of\\nexperience, nationality, personal appearance, race, religion, or sexual identity\\nand orientation.\"), mdx(\"p\", null, mdx(\"a\", _extends({\n    parentName: \"p\"\n  }, {\n    \"href\": \"/contributing/code-of-conduct/\"\n  }), \"Read full code of conduct\")), mdx(\"h2\", {\n    \"id\": \"ways-to-contribute\"\n  }, mdx(\"a\", _extends({\n    parentName: \"h2\"\n  }, {\n    \"href\": \"#ways-to-contribute\",\n    \"aria-label\": \"ways to contribute permalink\",\n    \"className\": \"anchor\"\n  }), mdx(\"svg\", _extends({\n    parentName: \"a\"\n  }, {\n    \"aria-hidden\": \"true\",\n    \"focusable\": \"false\",\n    \"height\": \"16\",\n    \"version\": \"1.1\",\n    \"viewBox\": \"0 0 16 16\",\n    \"width\": \"16\"\n  }), mdx(\"path\", _extends({\n    parentName: \"svg\"\n  }, {\n    \"fillRule\": \"evenodd\",\n    \"d\": \"M4 9h1v1H4c-1.5 0-3-1.69-3-3.5S2.55 3 4 3h4c1.45 0 3 1.69 3 3.5 0 1.41-.91 2.72-2 3.25V8.59c.58-.45 1-1.27 1-2.09C10 5.22 8.98 4 8 4H4c-.98 0-2 1.22-2 2.5S3 9 4 9zm9-3h-1v1h1c1 0 2 1.22 2 2.5S13.98 12 13 12H9c-.98 0-2-1.22-2-2.5 0-.83.42-1.64 1-2.09V6.25c-1.09.53-2 1.84-2 3.25C6 11.31 7.55 13 9 13h4c1.45 0 3-1.69 3-3.5S14.5 6 13 6z\"\n  })))), \"Ways to Contribute\"), mdx(\"p\", null, \"The Gatsby community welcomes contributions. Please refer to the guides below on how to make sure your contributions get accepted:\"), mdx(\"ul\", null, mdx(\"li\", {\n    parentName: \"ul\"\n  }, mdx(\"a\", _extends({\n    parentName: \"li\"\n  }, {\n    \"href\": \"/contributing/how-to-contribute/\"\n  }), \"How to Contribute\")), mdx(\"li\", {\n    parentName: \"ul\"\n  }, mdx(\"a\", _extends({\n    parentName: \"li\"\n  }, {\n    \"href\": \"/contributing/how-to-file-an-issue/\"\n  }), \"How to File an Issue\")), mdx(\"li\", {\n    parentName: \"ul\"\n  }, mdx(\"a\", _extends({\n    parentName: \"li\"\n  }, {\n    \"href\": \"/blog/2018-04-06-introducing-gatsby-rfc-process/\"\n  }), \"Make feature requests with an RFC\")), mdx(\"li\", {\n    parentName: \"ul\"\n  }, mdx(\"a\", _extends({\n    parentName: \"li\"\n  }, {\n    \"href\": \"/contributing/gatsby-style-guide/\"\n  }), \"Gatsby Style Guide\"))), mdx(\"h2\", {\n    \"id\": \"gatsby-news\"\n  }, mdx(\"a\", _extends({\n    parentName: \"h2\"\n  }, {\n    \"href\": \"#gatsby-news\",\n    \"aria-label\": \"gatsby news permalink\",\n    \"className\": \"anchor\"\n  }), mdx(\"svg\", _extends({\n    parentName: \"a\"\n  }, {\n    \"aria-hidden\": \"true\",\n    \"focusable\": \"false\",\n    \"height\": \"16\",\n    \"version\": \"1.1\",\n    \"viewBox\": \"0 0 16 16\",\n    \"width\": \"16\"\n  }), mdx(\"path\", _extends({\n    parentName: \"svg\"\n  }, {\n    \"fillRule\": \"evenodd\",\n    \"d\": \"M4 9h1v1H4c-1.5 0-3-1.69-3-3.5S2.55 3 4 3h4c1.45 0 3 1.69 3 3.5 0 1.41-.91 2.72-2 3.25V8.59c.58-.45 1-1.27 1-2.09C10 5.22 8.98 4 8 4H4c-.98 0-2 1.22-2 2.5S3 9 4 9zm9-3h-1v1h1c1 0 2 1.22 2 2.5S13.98 12 13 12H9c-.98 0-2-1.22-2-2.5 0-.83.42-1.64 1-2.09V6.25c-1.09.53-2 1.84-2 3.25C6 11.31 7.55 13 9 13h4c1.45 0 3-1.69 3-3.5S14.5 6 13 6z\"\n  })))), \"Gatsby news\"), mdx(\"h3\", {\n    \"id\": \"newsletter\"\n  }, mdx(\"a\", _extends({\n    parentName: \"h3\"\n  }, {\n    \"href\": \"#newsletter\",\n    \"aria-label\": \"newsletter permalink\",\n    \"className\": \"anchor\"\n  }), mdx(\"svg\", _extends({\n    parentName: \"a\"\n  }, {\n    \"aria-hidden\": \"true\",\n    \"focusable\": \"false\",\n    \"height\": \"16\",\n    \"version\": \"1.1\",\n    \"viewBox\": \"0 0 16 16\",\n    \"width\": \"16\"\n  }), mdx(\"path\", _extends({\n    parentName: \"svg\"\n  }, {\n    \"fillRule\": \"evenodd\",\n    \"d\": \"M4 9h1v1H4c-1.5 0-3-1.69-3-3.5S2.55 3 4 3h4c1.45 0 3 1.69 3 3.5 0 1.41-.91 2.72-2 3.25V8.59c.58-.45 1-1.27 1-2.09C10 5.22 8.98 4 8 4H4c-.98 0-2 1.22-2 2.5S3 9 4 9zm9-3h-1v1h1c1 0 2 1.22 2 2.5S13.98 12 13 12H9c-.98 0-2-1.22-2-2.5 0-.83.42-1.64 1-2.09V6.25c-1.09.53-2 1.84-2 3.25C6 11.31 7.55 13 9 13h4c1.45 0 3-1.69 3-3.5S14.5 6 13 6z\"\n  })))), \"Newsletter\"), mdx(\"p\", null, \"Sign up for the Gatsby newsletter to keep up with the latest from the Gatsby community! Hear about new features, tips & tricks, and what people are building.\"), mdx(\"p\", null, mdx(\"a\", _extends({\n    parentName: \"p\"\n  }, {\n    \"href\": \"/newsletter/\"\n  }), \"Sign up here\")), mdx(\"h3\", {\n    \"id\": \"twitter\"\n  }, mdx(\"a\", _extends({\n    parentName: \"h3\"\n  }, {\n    \"href\": \"#twitter\",\n    \"aria-label\": \"twitter permalink\",\n    \"className\": \"anchor\"\n  }), mdx(\"svg\", _extends({\n    parentName: \"a\"\n  }, {\n    \"aria-hidden\": \"true\",\n    \"focusable\": \"false\",\n    \"height\": \"16\",\n    \"version\": \"1.1\",\n    \"viewBox\": \"0 0 16 16\",\n    \"width\": \"16\"\n  }), mdx(\"path\", _extends({\n    parentName: \"svg\"\n  }, {\n    \"fillRule\": \"evenodd\",\n    \"d\": \"M4 9h1v1H4c-1.5 0-3-1.69-3-3.5S2.55 3 4 3h4c1.45 0 3 1.69 3 3.5 0 1.41-.91 2.72-2 3.25V8.59c.58-.45 1-1.27 1-2.09C10 5.22 8.98 4 8 4H4c-.98 0-2 1.22-2 2.5S3 9 4 9zm9-3h-1v1h1c1 0 2 1.22 2 2.5S13.98 12 13 12H9c-.98 0-2-1.22-2-2.5 0-.83.42-1.64 1-2.09V6.25c-1.09.53-2 1.84-2 3.25C6 11.31 7.55 13 9 13h4c1.45 0 3-1.69 3-3.5S14.5 6 13 6z\"\n  })))), \"Twitter\"), mdx(\"p\", null, \"For the latest news about Gatsby,\\n\", mdx(\"a\", _extends({\n    parentName: \"p\"\n  }, {\n    \"href\": \"https://twitter.com/gatsbyjs\"\n  }), \"follow \", mdx(\"strong\", {\n    parentName: \"a\"\n  }, \"@gatsbyjs\"), \" on Twitter\"), \".\"), mdx(\"h3\", {\n    \"id\": \"core-maintainers-meeting\"\n  }, mdx(\"a\", _extends({\n    parentName: \"h3\"\n  }, {\n    \"href\": \"#core-maintainers-meeting\",\n    \"aria-label\": \"core maintainers meeting permalink\",\n    \"className\": \"anchor\"\n  }), mdx(\"svg\", _extends({\n    parentName: \"a\"\n  }, {\n    \"aria-hidden\": \"true\",\n    \"focusable\": \"false\",\n    \"height\": \"16\",\n    \"version\": \"1.1\",\n    \"viewBox\": \"0 0 16 16\",\n    \"width\": \"16\"\n  }), mdx(\"path\", _extends({\n    parentName: \"svg\"\n  }, {\n    \"fillRule\": \"evenodd\",\n    \"d\": \"M4 9h1v1H4c-1.5 0-3-1.69-3-3.5S2.55 3 4 3h4c1.45 0 3 1.69 3 3.5 0 1.41-.91 2.72-2 3.25V8.59c.58-.45 1-1.27 1-2.09C10 5.22 8.98 4 8 4H4c-.98 0-2 1.22-2 2.5S3 9 4 9zm9-3h-1v1h1c1 0 2 1.22 2 2.5S13.98 12 13 12H9c-.98 0-2-1.22-2-2.5 0-.83.42-1.64 1-2.09V6.25c-1.09.53-2 1.84-2 3.25C6 11.31 7.55 13 9 13h4c1.45 0 3-1.69 3-3.5S14.5 6 13 6z\"\n  })))), \"Core Maintainers Meeting\"), mdx(\"p\", null, \"The Gatsby Core team (official Gatsby employees who are working on Gatsby open-source) holds a weekly meeting where we encourage community members to share their projects, struggles, and successes directly with the Gatsby Core team. Additionally the Core team shares pertinent info and plans that are applicable to the community!\"), mdx(\"p\", null, \"This event is held on a recurring basis, every Wednesday at 8:45 AM Pacific Standard Time (PST).\"), mdx(\"p\", null, mdx(\"a\", _extends({\n    parentName: \"p\"\n  }, {\n    \"href\": \"https://gatsby.dev/core-maintainers\"\n  }), \"Add the recurring calendar invite here\")), mdx(\"h2\", {\n    \"id\": \"where-to-get-support\"\n  }, mdx(\"a\", _extends({\n    parentName: \"h2\"\n  }, {\n    \"href\": \"#where-to-get-support\",\n    \"aria-label\": \"where to get support permalink\",\n    \"className\": \"anchor\"\n  }), mdx(\"svg\", _extends({\n    parentName: \"a\"\n  }, {\n    \"aria-hidden\": \"true\",\n    \"focusable\": \"false\",\n    \"height\": \"16\",\n    \"version\": \"1.1\",\n    \"viewBox\": \"0 0 16 16\",\n    \"width\": \"16\"\n  }), mdx(\"path\", _extends({\n    parentName: \"svg\"\n  }, {\n    \"fillRule\": \"evenodd\",\n    \"d\": \"M4 9h1v1H4c-1.5 0-3-1.69-3-3.5S2.55 3 4 3h4c1.45 0 3 1.69 3 3.5 0 1.41-.91 2.72-2 3.25V8.59c.58-.45 1-1.27 1-2.09C10 5.22 8.98 4 8 4H4c-.98 0-2 1.22-2 2.5S3 9 4 9zm9-3h-1v1h1c1 0 2 1.22 2 2.5S13.98 12 13 12H9c-.98 0-2-1.22-2-2.5 0-.83.42-1.64 1-2.09V6.25c-1.09.53-2 1.84-2 3.25C6 11.31 7.55 13 9 13h4c1.45 0 3-1.69 3-3.5S14.5 6 13 6z\"\n  })))), \"Where to get support\"), mdx(\"h3\", {\n    \"id\": \"stack-overflow\"\n  }, mdx(\"a\", _extends({\n    parentName: \"h3\"\n  }, {\n    \"href\": \"#stack-overflow\",\n    \"aria-label\": \"stack overflow permalink\",\n    \"className\": \"anchor\"\n  }), mdx(\"svg\", _extends({\n    parentName: \"a\"\n  }, {\n    \"aria-hidden\": \"true\",\n    \"focusable\": \"false\",\n    \"height\": \"16\",\n    \"version\": \"1.1\",\n    \"viewBox\": \"0 0 16 16\",\n    \"width\": \"16\"\n  }), mdx(\"path\", _extends({\n    parentName: \"svg\"\n  }, {\n    \"fillRule\": \"evenodd\",\n    \"d\": \"M4 9h1v1H4c-1.5 0-3-1.69-3-3.5S2.55 3 4 3h4c1.45 0 3 1.69 3 3.5 0 1.41-.91 2.72-2 3.25V8.59c.58-.45 1-1.27 1-2.09C10 5.22 8.98 4 8 4H4c-.98 0-2 1.22-2 2.5S3 9 4 9zm9-3h-1v1h1c1 0 2 1.22 2 2.5S13.98 12 13 12H9c-.98 0-2-1.22-2-2.5 0-.83.42-1.64 1-2.09V6.25c-1.09.53-2 1.84-2 3.25C6 11.31 7.55 13 9 13h4c1.45 0 3-1.69 3-3.5S14.5 6 13 6z\"\n  })))), \"Stack Overflow\"), mdx(\"p\", null, \"Many members of the community use Stack Overflow to ask questions. Read through\\nthe \", mdx(\"a\", _extends({\n    parentName: \"p\"\n  }, {\n    \"href\": \"http://stackoverflow.com/questions/tagged/gatsby\"\n  }), \"existing questions\"), \"\\ntagged with \", mdx(\"strong\", {\n    parentName: \"p\"\n  }, \"gatsby\"), \" or\\n\", mdx(\"a\", _extends({\n    parentName: \"p\"\n  }, {\n    \"href\": \"http://stackoverflow.com/questions/ask?tags=gatsby\"\n  }), \"ask your own\"), \"!\"), mdx(\"h3\", {\n    \"id\": \"discord\"\n  }, mdx(\"a\", _extends({\n    parentName: \"h3\"\n  }, {\n    \"href\": \"#discord\",\n    \"aria-label\": \"discord permalink\",\n    \"className\": \"anchor\"\n  }), mdx(\"svg\", _extends({\n    parentName: \"a\"\n  }, {\n    \"aria-hidden\": \"true\",\n    \"focusable\": \"false\",\n    \"height\": \"16\",\n    \"version\": \"1.1\",\n    \"viewBox\": \"0 0 16 16\",\n    \"width\": \"16\"\n  }), mdx(\"path\", _extends({\n    parentName: \"svg\"\n  }, {\n    \"fillRule\": \"evenodd\",\n    \"d\": \"M4 9h1v1H4c-1.5 0-3-1.69-3-3.5S2.55 3 4 3h4c1.45 0 3 1.69 3 3.5 0 1.41-.91 2.72-2 3.25V8.59c.58-.45 1-1.27 1-2.09C10 5.22 8.98 4 8 4H4c-.98 0-2 1.22-2 2.5S3 9 4 9zm9-3h-1v1h1c1 0 2 1.22 2 2.5S13.98 12 13 12H9c-.98 0-2-1.22-2-2.5 0-.83.42-1.64 1-2.09V6.25c-1.09.53-2 1.84-2 3.25C6 11.31 7.55 13 9 13h4c1.45 0 3-1.69 3-3.5S14.5 6 13 6z\"\n  })))), \"Discord\"), mdx(\"p\", null, \"If you need an answer right away, check out the\\n\", mdx(\"a\", _extends({\n    parentName: \"p\"\n  }, {\n    \"href\": \"https://gatsby.dev/discord\"\n  }), \"Gatsby Discord\"), \". Community & team members are happy to help you out or point you to\\nuseful resources.\"), mdx(\"h3\", {\n    \"id\": \"hashnode\"\n  }, mdx(\"a\", _extends({\n    parentName: \"h3\"\n  }, {\n    \"href\": \"#hashnode\",\n    \"aria-label\": \"hashnode permalink\",\n    \"className\": \"anchor\"\n  }), mdx(\"svg\", _extends({\n    parentName: \"a\"\n  }, {\n    \"aria-hidden\": \"true\",\n    \"focusable\": \"false\",\n    \"height\": \"16\",\n    \"version\": \"1.1\",\n    \"viewBox\": \"0 0 16 16\",\n    \"width\": \"16\"\n  }), mdx(\"path\", _extends({\n    parentName: \"svg\"\n  }, {\n    \"fillRule\": \"evenodd\",\n    \"d\": \"M4 9h1v1H4c-1.5 0-3-1.69-3-3.5S2.55 3 4 3h4c1.45 0 3 1.69 3 3.5 0 1.41-.91 2.72-2 3.25V8.59c.58-.45 1-1.27 1-2.09C10 5.22 8.98 4 8 4H4c-.98 0-2 1.22-2 2.5S3 9 4 9zm9-3h-1v1h1c1 0 2 1.22 2 2.5S13.98 12 13 12H9c-.98 0-2-1.22-2-2.5 0-.83.42-1.64 1-2.09V6.25c-1.09.53-2 1.84-2 3.25C6 11.31 7.55 13 9 13h4c1.45 0 3-1.69 3-3.5S14.5 6 13 6z\"\n  })))), \"Hashnode\"), mdx(\"p\", null, \"Many members of the community also use Hashnode to ask questions and share their tips. Read through\\nthe \", mdx(\"a\", _extends({\n    parentName: \"p\"\n  }, {\n    \"href\": \"https://hashnode.com/n/gatsby\"\n  }), \"existing questions and posts\"), \"\\ntagged with \", mdx(\"strong\", {\n    parentName: \"p\"\n  }, \"gatsby\"), \" or\\n\", mdx(\"a\", _extends({\n    parentName: \"p\"\n  }, {\n    \"href\": \"https://hashnode.com/create/question\"\n  }), \"ask your own question\"), \" or \", mdx(\"a\", _extends({\n    parentName: \"p\"\n  }, {\n    \"href\": \"https://hashnode.com/create/story\"\n  }), \"share your story\"), \" and add the \", mdx(\"inlineCode\", {\n    parentName: \"p\"\n  }, \"gatsby\"), \" tag.\"), mdx(\"h2\", {\n    \"id\": \"learn-more-about-gatsby\"\n  }, mdx(\"a\", _extends({\n    parentName: \"h2\"\n  }, {\n    \"href\": \"#learn-more-about-gatsby\",\n    \"aria-label\": \"learn more about gatsby permalink\",\n    \"className\": \"anchor\"\n  }), mdx(\"svg\", _extends({\n    parentName: \"a\"\n  }, {\n    \"aria-hidden\": \"true\",\n    \"focusable\": \"false\",\n    \"height\": \"16\",\n    \"version\": \"1.1\",\n    \"viewBox\": \"0 0 16 16\",\n    \"width\": \"16\"\n  }), mdx(\"path\", _extends({\n    parentName: \"svg\"\n  }, {\n    \"fillRule\": \"evenodd\",\n    \"d\": \"M4 9h1v1H4c-1.5 0-3-1.69-3-3.5S2.55 3 4 3h4c1.45 0 3 1.69 3 3.5 0 1.41-.91 2.72-2 3.25V8.59c.58-.45 1-1.27 1-2.09C10 5.22 8.98 4 8 4H4c-.98 0-2 1.22-2 2.5S3 9 4 9zm9-3h-1v1h1c1 0 2 1.22 2 2.5S13.98 12 13 12H9c-.98 0-2-1.22-2-2.5 0-.83.42-1.64 1-2.09V6.25c-1.09.53-2 1.84-2 3.25C6 11.31 7.55 13 9 13h4c1.45 0 3-1.69 3-3.5S14.5 6 13 6z\"\n  })))), \"Learn More About Gatsby:\"), mdx(\"ul\", null, mdx(\"li\", {\n    parentName: \"ul\"\n  }, mdx(\"a\", _extends({\n    parentName: \"li\"\n  }, {\n    \"href\": \"/contributing/why-contribute-to-gatsby/\"\n  }), \"Why Contribute to Gatsby?\")), mdx(\"li\", {\n    parentName: \"ul\"\n  }, mdx(\"a\", _extends({\n    parentName: \"li\"\n  }, {\n    \"href\": \"/contributing/events/\"\n  }), \"Gatsby Community Events\")), mdx(\"li\", {\n    parentName: \"ul\"\n  }, mdx(\"a\", _extends({\n    parentName: \"li\"\n  }, {\n    \"href\": \"/contributing/where-to-participate/\"\n  }), \"Where to Participate in the Community?\")), mdx(\"li\", {\n    parentName: \"ul\"\n  }, mdx(\"a\", _extends({\n    parentName: \"li\"\n  }, {\n    \"href\": \"/contributing/organize-a-gatsby-event/\"\n  }), \"Organize a Gatsby Event\")), mdx(\"li\", {\n    parentName: \"ul\"\n  }, mdx(\"a\", _extends({\n    parentName: \"li\"\n  }, {\n    \"href\": \"/contributing/how-to-run-a-gatsby-workshop/\"\n  }), \"How to Run a Gatsby Workshop\")), mdx(\"li\", {\n    parentName: \"ul\"\n  }, mdx(\"a\", _extends({\n    parentName: \"li\"\n  }, {\n    \"href\": \"/contributing/how-to-pitch-gatsby/\"\n  }), \"How to Pitch Gatsby\")), mdx(\"li\", {\n    parentName: \"ul\"\n  }, mdx(\"a\", _extends({\n    parentName: \"li\"\n  }, {\n    \"href\": \"/blog/tags/community/\"\n  }), \"Blog posts on the Gatsby community\"))));\n}\n;\nMDXContent.isMDXComponent = true;",
        "excerpt": "As of March 2019, the Gatsby community is comprised of over 1,800 contributors and tens of thousands of developers building both personal…",
        "timeToRead": 2,
        "tableOfContents": {
          "items": [
            {
              "url": "#gatsby-contributor-covenant-code-of-conduct",
              "title": "Gatsby Contributor Covenant Code of Conduct"
            },
            {
              "url": "#ways-to-contribute",
              "title": "Ways to Contribute"
            },
            {
              "url": "#gatsby-news",
              "title": "Gatsby news",
              "items": [
                {
                  "url": "#newsletter",
                  "title": "Newsletter"
                },
                {
                  "url": "#twitter",
                  "title": "Twitter"
                },
                {
                  "url": "#core-maintainers-meeting",
                  "title": "Core Maintainers Meeting"
                }
              ]
            },
            {
              "url": "#where-to-get-support",
              "title": "Where to get support",
              "items": [
                {
                  "url": "#stack-overflow",
                  "title": "Stack Overflow"
                },
                {
                  "url": "#discord",
                  "title": "Discord"
                },
                {
                  "url": "#hashnode",
                  "title": "Hashnode"
                }
              ]
            },
            {
              "url": "#learn-more-about-gatsby",
              "title": "Learn More About Gatsby:"
            }
          ]
        },
        "fields": {
          "slug": "/contributing/community/",
          "anchor": "community"
        },
        "frontmatter": {
          "title": "Community",
          "overview": null,
          "issue": null,
          "disableTableOfContents": null,
          "tableOfContentsDepth": null
        },
        "parent": {
          "__typename": "File",
          "relativePath": "contributing/community.md"
        }
      }
    },
    "pageContext": {
      "isCreatedByStatefulCreatePages": false,
      "slug": "/contributing/community/",
      "prev": {
        "title": "Introduction",
        "link": "/contributing/"
      },
      "next": {
        "title": "Why Contribute to Gatsby?",
        "link": "/contributing/why-contribute-to-gatsby/"
      }
    }
  },
  "query": "query usersMisiekDevGatsbyWwwSrcTemplatesTemplateDocsMarkdownJs2546709735(\n  $path: String!\n) {\n  mdx(fields: {slug: {eq: $path}}) {\n    body\n    excerpt\n    timeToRead\n    tableOfContents\n    fields {\n      slug\n      anchor\n    }\n    frontmatter {\n      title\n      overview\n      issue\n      disableTableOfContents\n      tableOfContentsDepth\n    }\n    ...MarkdownPageFooterMdx\n  }\n}\n\nfragment MarkdownPageFooterMdx on Mdx {\n  parent {\n    __typename\n    ... on File {\n      relativePath\n    }\n  }\n}\n"
}