{
  "path": "/contributing/docs-contributions/",
  "result": {
    "data": {
      "mdx": {
        "body": "function _extends() { _extends = Object.assign || function (target) { for (var i = 1; i < arguments.length; i++) { var source = arguments[i]; for (var key in source) { if (Object.prototype.hasOwnProperty.call(source, key)) { target[key] = source[key]; } } } return target; }; return _extends.apply(this, arguments); }\n\nfunction _objectWithoutProperties(source, excluded) { if (source == null) return {}; var target = _objectWithoutPropertiesLoose(source, excluded); var key, i; if (Object.getOwnPropertySymbols) { var sourceSymbolKeys = Object.getOwnPropertySymbols(source); for (i = 0; i < sourceSymbolKeys.length; i++) { key = sourceSymbolKeys[i]; if (excluded.indexOf(key) >= 0) continue; if (!Object.prototype.propertyIsEnumerable.call(source, key)) continue; target[key] = source[key]; } } return target; }\n\nfunction _objectWithoutPropertiesLoose(source, excluded) { if (source == null) return {}; var target = {}; var sourceKeys = Object.keys(source); var key, i; for (i = 0; i < sourceKeys.length; i++) { key = sourceKeys[i]; if (excluded.indexOf(key) >= 0) continue; target[key] = source[key]; } return target; }\n\n/* @jsx mdx */\nvar _frontmatter = {\n  \"title\": \"Docs Contributions\"\n};\n\nvar makeShortcode = function makeShortcode(name) {\n  return function MDXDefaultShortcode(props) {\n    console.warn(\"Component \" + name + \" was not imported, exported, or provided by MDXProvider as global scope\");\n    return mdx(\"div\", props);\n  };\n};\n\nvar layoutProps = {\n  _frontmatter: _frontmatter\n};\nvar MDXLayout = \"wrapper\";\nreturn function MDXContent(_ref) {\n  var components = _ref.components,\n      props = _objectWithoutProperties(_ref, [\"components\"]);\n\n  return mdx(MDXLayout, _extends({}, layoutProps, props, {\n    components: components,\n    mdxType: \"MDXLayout\"\n  }), mdx(\"p\", null, \"Gatsby, unsurprisingly, uses Gatsby for its documentation website. Thank you in advance and cheers for contributing to Gatsby documentation! As of February 2019, over 800 people have contributed. It\\u2019s people like you that make this community great!\"), mdx(\"p\", null, \"On this page:\"), mdx(\"ul\", null, mdx(\"li\", {\n    parentName: \"ul\"\n  }, mdx(\"a\", _extends({\n    parentName: \"li\"\n  }, {\n    \"href\": \"#top-priorities\"\n  }), \"Top priorities\")), mdx(\"li\", {\n    parentName: \"ul\"\n  }, mdx(\"a\", _extends({\n    parentName: \"li\"\n  }, {\n    \"href\": \"#options-for-contributing-to-the-gatsby-docs\"\n  }), \"Options for contributing to the Gatsby docs\")), mdx(\"li\", {\n    parentName: \"ul\"\n  }, mdx(\"a\", _extends({\n    parentName: \"li\"\n  }, {\n    \"href\": \"#fixing-image-and-link-paths\"\n  }), \"Fixing image and link paths\")), mdx(\"li\", {\n    parentName: \"ul\"\n  }, mdx(\"a\", _extends({\n    parentName: \"li\"\n  }, {\n    \"href\": \"#headings\"\n  }), \"Headings\")), mdx(\"li\", {\n    parentName: \"ul\"\n  }, mdx(\"a\", _extends({\n    parentName: \"li\"\n  }, {\n    \"href\": \"#modifying-markdown-files\"\n  }), \"Modifying markdown files\"), mdx(\"ul\", {\n    parentName: \"li\"\n  }, mdx(\"li\", {\n    parentName: \"ul\"\n  }, mdx(\"a\", _extends({\n    parentName: \"li\"\n  }, {\n    \"href\": \"#converting-a-document-from-a-stub\"\n  }), \"Converting a document from a stub\")))), mdx(\"li\", {\n    parentName: \"ul\"\n  }, mdx(\"a\", _extends({\n    parentName: \"li\"\n  }, {\n    \"href\": \"#docs-site-setup-instructions\"\n  }), \"Docs site setup instructions\")), mdx(\"li\", {\n    parentName: \"ul\"\n  }, mdx(\"a\", _extends({\n    parentName: \"li\"\n  }, {\n    \"href\": \"#docs-renaming-instructions\"\n  }), \"Docs renaming instructions\")), mdx(\"li\", {\n    parentName: \"ul\"\n  }, mdx(\"a\", _extends({\n    parentName: \"li\"\n  }, {\n    \"href\": \"#claim-your-swag\"\n  }), \"Claim your swag\")), mdx(\"li\", {\n    parentName: \"ul\"\n  }, mdx(\"a\", _extends({\n    parentName: \"li\"\n  }, {\n    \"href\": \"#want-more\"\n  }), \"Want more?\"))), mdx(\"blockquote\", null, mdx(\"p\", {\n    parentName: \"blockquote\"\n  }, mdx(\"em\", {\n    parentName: \"p\"\n  }, \"When deciding where to contribute to Gatsby (docs or \", mdx(\"a\", _extends({\n    parentName: \"em\"\n  }, {\n    \"href\": \"/contributing/blog-and-website-contributions/\"\n  }), \"blog\"), \"?), check out the \", mdx(\"a\", _extends({\n    parentName: \"em\"\n  }, {\n    \"href\": \"/contributing/docs-templates/\"\n  }), \"docs templates\"), \" page.\"))), mdx(\"h2\", {\n    \"id\": \"top-priorities\"\n  }, mdx(\"a\", _extends({\n    parentName: \"h2\"\n  }, {\n    \"href\": \"#top-priorities\",\n    \"aria-label\": \"top priorities permalink\",\n    \"className\": \"anchor\"\n  }), mdx(\"svg\", _extends({\n    parentName: \"a\"\n  }, {\n    \"aria-hidden\": \"true\",\n    \"focusable\": \"false\",\n    \"height\": \"16\",\n    \"version\": \"1.1\",\n    \"viewBox\": \"0 0 16 16\",\n    \"width\": \"16\"\n  }), mdx(\"path\", _extends({\n    parentName: \"svg\"\n  }, {\n    \"fillRule\": \"evenodd\",\n    \"d\": \"M4 9h1v1H4c-1.5 0-3-1.69-3-3.5S2.55 3 4 3h4c1.45 0 3 1.69 3 3.5 0 1.41-.91 2.72-2 3.25V8.59c.58-.45 1-1.27 1-2.09C10 5.22 8.98 4 8 4H4c-.98 0-2 1.22-2 2.5S3 9 4 9zm9-3h-1v1h1c1 0 2 1.22 2 2.5S13.98 12 13 12H9c-.98 0-2-1.22-2-2.5 0-.83.42-1.64 1-2.09V6.25c-1.09.53-2 1.84-2 3.25C6 11.31 7.55 13 9 13h4c1.45 0 3-1.69 3-3.5S14.5 6 13 6z\"\n  })))), \"Top priorities\"), mdx(\"p\", null, \"Check the GitHub repo for issues labeled with \", mdx(\"a\", _extends({\n    parentName: \"p\"\n  }, {\n    \"href\": \"https://github.com/gatsbyjs/gatsby/issues?q=is%3Aissue+is%3Aopen+sort%3Aupdated-desc+label%3A%22type%3A+documentation%22+label%3A%22good+first+issue%22\"\n  }), \"\\u201Cdocumentation\\u201D and \\u201Cgood first issue\\u201D\"), \" for your first time contributing to Gatsby, or \", mdx(\"a\", _extends({\n    parentName: \"p\"\n  }, {\n    \"href\": \"https://github.com/gatsbyjs/gatsby/issues?q=is%3Aissue+is%3Aopen+sort%3Aupdated-desc+label%3A%22type%3A+documentation%22+label%3A%22help+wanted%22\"\n  }), \"\\u201Cdocumentation\\u201D and \\u201Chelp wanted\\u201D\"), \" to see all documentation issues that are ready for community help. Once you start a Pull Request to address one of these issues, you can remove the \\u201Chelp wanted\\u201D label. As well, examine the list of articles that haven\\u2019t been fully fleshed out at the \", mdx(\"a\", _extends({\n    parentName: \"p\"\n  }, {\n    \"href\": \"/contributing/stub-list\"\n  }), \"Stub List\"), \".\"), mdx(\"h2\", {\n    \"id\": \"options-for-contributing-to-the-gatsby-docs\"\n  }, mdx(\"a\", _extends({\n    parentName: \"h2\"\n  }, {\n    \"href\": \"#options-for-contributing-to-the-gatsby-docs\",\n    \"aria-label\": \"options for contributing to the gatsby docs permalink\",\n    \"className\": \"anchor\"\n  }), mdx(\"svg\", _extends({\n    parentName: \"a\"\n  }, {\n    \"aria-hidden\": \"true\",\n    \"focusable\": \"false\",\n    \"height\": \"16\",\n    \"version\": \"1.1\",\n    \"viewBox\": \"0 0 16 16\",\n    \"width\": \"16\"\n  }), mdx(\"path\", _extends({\n    parentName: \"svg\"\n  }, {\n    \"fillRule\": \"evenodd\",\n    \"d\": \"M4 9h1v1H4c-1.5 0-3-1.69-3-3.5S2.55 3 4 3h4c1.45 0 3 1.69 3 3.5 0 1.41-.91 2.72-2 3.25V8.59c.58-.45 1-1.27 1-2.09C10 5.22 8.98 4 8 4H4c-.98 0-2 1.22-2 2.5S3 9 4 9zm9-3h-1v1h1c1 0 2 1.22 2 2.5S13.98 12 13 12H9c-.98 0-2-1.22-2-2.5 0-.83.42-1.64 1-2.09V6.25c-1.09.53-2 1.84-2 3.25C6 11.31 7.55 13 9 13h4c1.45 0 3-1.69 3-3.5S14.5 6 13 6z\"\n  })))), \"Options for contributing to the Gatsby docs\"), mdx(\"p\", null, \"When working on the Gatsby.js documentation, you can choose between two major styles of working:\"), mdx(\"ul\", null, mdx(\"li\", {\n    parentName: \"ul\"\n  }, mdx(\"a\", _extends({\n    parentName: \"li\"\n  }, {\n    \"href\": \"#modifying-markdown-files\"\n  }), \"Work directly in the GitHub UI\"), \", using the \\u201CEdit this File\\u201D and commit capabilities without having to clone the repository. This is useful for quick documentation updates, typo fixes, and lightweight Markdown changes.\"), mdx(\"li\", {\n    parentName: \"ul\"\n  }, \"Clone the Gatsby.js repo and get the \", mdx(\"inlineCode\", {\n    parentName: \"li\"\n  }, \"www\"), \" site up and running locally. This is necessary for more thorough documentation content and infrastructure changes. Learn how to get set up in the \", mdx(\"a\", _extends({\n    parentName: \"li\"\n  }, {\n    \"href\": \"#docs-site-setup-instructions\"\n  }), \"Gatsby docs setup instructions\"), \".\")), mdx(\"h2\", {\n    \"id\": \"fixing-image-and-link-paths\"\n  }, mdx(\"a\", _extends({\n    parentName: \"h2\"\n  }, {\n    \"href\": \"#fixing-image-and-link-paths\",\n    \"aria-label\": \"fixing image and link paths permalink\",\n    \"className\": \"anchor\"\n  }), mdx(\"svg\", _extends({\n    parentName: \"a\"\n  }, {\n    \"aria-hidden\": \"true\",\n    \"focusable\": \"false\",\n    \"height\": \"16\",\n    \"version\": \"1.1\",\n    \"viewBox\": \"0 0 16 16\",\n    \"width\": \"16\"\n  }), mdx(\"path\", _extends({\n    parentName: \"svg\"\n  }, {\n    \"fillRule\": \"evenodd\",\n    \"d\": \"M4 9h1v1H4c-1.5 0-3-1.69-3-3.5S2.55 3 4 3h4c1.45 0 3 1.69 3 3.5 0 1.41-.91 2.72-2 3.25V8.59c.58-.45 1-1.27 1-2.09C10 5.22 8.98 4 8 4H4c-.98 0-2 1.22-2 2.5S3 9 4 9zm9-3h-1v1h1c1 0 2 1.22 2 2.5S13.98 12 13 12H9c-.98 0-2-1.22-2-2.5 0-.83.42-1.64 1-2.09V6.25c-1.09.53-2 1.84-2 3.25C6 11.31 7.55 13 9 13h4c1.45 0 3-1.69 3-3.5S14.5 6 13 6z\"\n  })))), \"Fixing image and link paths\"), mdx(\"p\", null, \"If you find a broken image URL in the Gatsby docs, it should be fixed and kept relative to the site source rather than linked to the remote repo on GitHub. This ensures that when the site is deployed, all images are included in the build.\"), mdx(\"p\", null, \"To address missing images, check the doc or tutorial source \", mdx(\"a\", _extends({\n    parentName: \"p\"\n  }, {\n    \"href\": \"https://github.com/gatsbyjs/gatsby/tree/master/docs\"\n  }), \"in the Gatsby repo\"), \" to see if it was moved in its history and if the images are still in its old location. Check to see if those images are also referenced from more than one doc. If they aren\\u2019t, move them to the new directory location (and update URL references relative to the content, if necessary). If they are referenced in more than one location, use relative paths and don\\u2019t duplicate images.\"), mdx(\"p\", null, \"If you find a broken link in the Gatsby docs, feel free to fix it and submit a PR!\"), mdx(\"h2\", {\n    \"id\": \"headings\"\n  }, mdx(\"a\", _extends({\n    parentName: \"h2\"\n  }, {\n    \"href\": \"#headings\",\n    \"aria-label\": \"headings permalink\",\n    \"className\": \"anchor\"\n  }), mdx(\"svg\", _extends({\n    parentName: \"a\"\n  }, {\n    \"aria-hidden\": \"true\",\n    \"focusable\": \"false\",\n    \"height\": \"16\",\n    \"version\": \"1.1\",\n    \"viewBox\": \"0 0 16 16\",\n    \"width\": \"16\"\n  }), mdx(\"path\", _extends({\n    parentName: \"svg\"\n  }, {\n    \"fillRule\": \"evenodd\",\n    \"d\": \"M4 9h1v1H4c-1.5 0-3-1.69-3-3.5S2.55 3 4 3h4c1.45 0 3 1.69 3 3.5 0 1.41-.91 2.72-2 3.25V8.59c.58-.45 1-1.27 1-2.09C10 5.22 8.98 4 8 4H4c-.98 0-2 1.22-2 2.5S3 9 4 9zm9-3h-1v1h1c1 0 2 1.22 2 2.5S13.98 12 13 12H9c-.98 0-2-1.22-2-2.5 0-.83.42-1.64 1-2.09V6.25c-1.09.53-2 1.84-2 3.25C6 11.31 7.55 13 9 13h4c1.45 0 3-1.69 3-3.5S14.5 6 13 6z\"\n  })))), \"Headings\"), mdx(\"p\", null, \"Docs with frontmatter metadata at the top including a \", mdx(\"inlineCode\", {\n    parentName: \"p\"\n  }, \"title\"), \" will automatically receive an \", mdx(\"inlineCode\", {\n    parentName: \"p\"\n  }, \"<h1>\"), \" heading in the rendered page, and it should be the only one. Additional headings in docs content should start with \", mdx(\"inlineCode\", {\n    parentName: \"p\"\n  }, \"<h2>\"), \", denoted by \", mdx(\"inlineCode\", {\n    parentName: \"p\"\n  }, \"##\"), \" in Markdown.\"), mdx(\"p\", null, \"For the purposes of an accessible document outline, content headings should go in order from h2-h4 (\", mdx(\"inlineCode\", {\n    parentName: \"p\"\n  }, \"####\"), \") until all levels have been established. This will ensure the Gatsby docs have a content hierarchy that works well for users of assistive technology. Read more about the importance of \", mdx(\"a\", _extends({\n    parentName: \"p\"\n  }, {\n    \"href\": \"https://webaim.org/techniques/semanticstructure/\"\n  }), \"headings and semantic structure in HTML\"), \".\"), mdx(\"h2\", {\n    \"id\": \"modifying-markdown-files\"\n  }, mdx(\"a\", _extends({\n    parentName: \"h2\"\n  }, {\n    \"href\": \"#modifying-markdown-files\",\n    \"aria-label\": \"modifying markdown files permalink\",\n    \"className\": \"anchor\"\n  }), mdx(\"svg\", _extends({\n    parentName: \"a\"\n  }, {\n    \"aria-hidden\": \"true\",\n    \"focusable\": \"false\",\n    \"height\": \"16\",\n    \"version\": \"1.1\",\n    \"viewBox\": \"0 0 16 16\",\n    \"width\": \"16\"\n  }), mdx(\"path\", _extends({\n    parentName: \"svg\"\n  }, {\n    \"fillRule\": \"evenodd\",\n    \"d\": \"M4 9h1v1H4c-1.5 0-3-1.69-3-3.5S2.55 3 4 3h4c1.45 0 3 1.69 3 3.5 0 1.41-.91 2.72-2 3.25V8.59c.58-.45 1-1.27 1-2.09C10 5.22 8.98 4 8 4H4c-.98 0-2 1.22-2 2.5S3 9 4 9zm9-3h-1v1h1c1 0 2 1.22 2 2.5S13.98 12 13 12H9c-.98 0-2-1.22-2-2.5 0-.83.42-1.64 1-2.09V6.25c-1.09.53-2 1.84-2 3.25C6 11.31 7.55 13 9 13h4c1.45 0 3-1.69 3-3.5S14.5 6 13 6z\"\n  })))), \"Modifying markdown files\"), mdx(\"ol\", null, mdx(\"li\", {\n    parentName: \"ol\"\n  }, \"If you want to add/modify any Gatsby documentation, go to the\\n\", mdx(\"a\", _extends({\n    parentName: \"li\"\n  }, {\n    \"href\": \"https://github.com/gatsbyjs/gatsby/tree/master/docs\"\n  }), \"docs folder\"), \" or \", mdx(\"a\", _extends({\n    parentName: \"li\"\n  }, {\n    \"href\": \"https://github.com/gatsbyjs/gatsby/tree/master/docs/contributing\"\n  }), \"contributing folder\"), \" on GitHub and\\nuse the file editor to edit and then preview your changes.\"), mdx(\"li\", {\n    parentName: \"ol\"\n  }, \"Before committing the change and raising a PR in the UI, you need to make sure the PR meets the docs contribution criteria:\", mdx(\"ul\", {\n    parentName: \"li\"\n  }, mdx(\"li\", {\n    parentName: \"ul\"\n  }, \"Follow the standards outlined in the \", mdx(\"a\", _extends({\n    parentName: \"li\"\n  }, {\n    \"href\": \"/contributing/gatsby-style-guide/\"\n  }), \"Gatsby Style Guide\"), \".\"), mdx(\"li\", {\n    parentName: \"ul\"\n  }, \"If your PR did not come from an issue written by the core team, please add a comment to your PR that explains why it should be included in the docs, according to the \", mdx(\"a\", _extends({\n    parentName: \"li\"\n  }, {\n    \"href\": \"/blog/2018-10-12-uptick-docs-contributions-hacktoberfest/#docs-decision-tree-and-examples\"\n  }), \"Docs Decision Tree\"), \".\", mdx(\"blockquote\", {\n    parentName: \"li\"\n  }, mdx(\"p\", {\n    parentName: \"blockquote\"\n  }, \"Note: If your issue and/or PR doesn\\u2019t meet the above contribution criteria, it may receive a comment reminding you to do so. If, after two weeks, these updates haven\\u2019t been made, your issue and/or PR may be closed, which helps us triage issues and PRs efficiently. You can request that it be reopened if and when you are ready to make the updates required.\"))))), mdx(\"li\", {\n    parentName: \"ol\"\n  }, \"GitHub then allows you to commit the change and raise a PR right in the UI. This is the \", mdx(\"em\", {\n    parentName: \"li\"\n  }, \"easiest\"), \" way you can contribute to the project!\")), mdx(\"h3\", {\n    \"id\": \"converting-a-document-from-a-stub\"\n  }, mdx(\"a\", _extends({\n    parentName: \"h3\"\n  }, {\n    \"href\": \"#converting-a-document-from-a-stub\",\n    \"aria-label\": \"converting a document from a stub permalink\",\n    \"className\": \"anchor\"\n  }), mdx(\"svg\", _extends({\n    parentName: \"a\"\n  }, {\n    \"aria-hidden\": \"true\",\n    \"focusable\": \"false\",\n    \"height\": \"16\",\n    \"version\": \"1.1\",\n    \"viewBox\": \"0 0 16 16\",\n    \"width\": \"16\"\n  }), mdx(\"path\", _extends({\n    parentName: \"svg\"\n  }, {\n    \"fillRule\": \"evenodd\",\n    \"d\": \"M4 9h1v1H4c-1.5 0-3-1.69-3-3.5S2.55 3 4 3h4c1.45 0 3 1.69 3 3.5 0 1.41-.91 2.72-2 3.25V8.59c.58-.45 1-1.27 1-2.09C10 5.22 8.98 4 8 4H4c-.98 0-2 1.22-2 2.5S3 9 4 9zm9-3h-1v1h1c1 0 2 1.22 2 2.5S13.98 12 13 12H9c-.98 0-2-1.22-2-2.5 0-.83.42-1.64 1-2.09V6.25c-1.09.53-2 1.84-2 3.25C6 11.31 7.55 13 9 13h4c1.45 0 3-1.69 3-3.5S14.5 6 13 6z\"\n  })))), \"Converting a document from a stub\"), mdx(\"p\", null, \"If you wrote a new document that was \", mdx(\"a\", _extends({\n    parentName: \"p\"\n  }, {\n    \"href\": \"/contributing/how-to-write-a-stub/\"\n  }), \"previously a stub\"), \", there are two things you need to update.\"), mdx(\"ol\", null, mdx(\"li\", {\n    parentName: \"ol\"\n  }, \"Remove the frontmatter that links to the issue\")), mdx(\"pre\", null, mdx(\"code\", _extends({\n    parentName: \"pre\"\n  }, {\n    \"className\": \"language-diff:title=docs/docs/example-doc.md\"\n  }), \"  ...\\n    title: Example Document\\n- - issue: https://github.com/gatsbyjs/gatsby/issues/00000\\n+ -\\n  ...\\n\")), mdx(\"ol\", {\n    \"start\": 2\n  }, mdx(\"li\", {\n    parentName: \"ol\"\n  }, \"Edit \", mdx(\"inlineCode\", {\n    parentName: \"li\"\n  }, \"www/src/data/sidebars/doc-links.yaml\"), \" by removing the asterisk behind the document\\u2019s title:\")), mdx(\"pre\", null, mdx(\"code\", _extends({\n    parentName: \"pre\"\n  }, {\n    \"className\": \"language-diff:title=www/src/data/sidebars/doc-links.yaml\"\n  }), \"  ...\\n- - title: Example Document*\\n+ - title: Example Document\\n    link: /docs/example-document/\\n  ...\\n\")), mdx(\"ol\", {\n    \"start\": 3\n  }, mdx(\"li\", {\n    parentName: \"ol\"\n  }, \"(Optional) if the name of the title seems long, consider adding a \", mdx(\"inlineCode\", {\n    parentName: \"li\"\n  }, \"breadcrumbTitle\"), \" to the entry in the \", mdx(\"inlineCode\", {\n    parentName: \"li\"\n  }, \"doc-links.yaml\"), \" file that is a shorter version of the title, and will show up in the breadcrumb on the docs page instead.\")), mdx(\"pre\", null, mdx(\"code\", _extends({\n    parentName: \"pre\"\n  }, {\n    \"className\": \"language-diff:title=www/src/data/sidebars/doc-links.yaml\"\n  }), \"  ...\\n  - title: Really, Really Long Example Document or Guide Title\\n    link: /docs/example-document/\\n+   breadcrumbTitle: Shorter Title to Display\\n  ...\\n\")), mdx(\"h2\", {\n    \"id\": \"docs-site-setup-instructions\"\n  }, mdx(\"a\", _extends({\n    parentName: \"h2\"\n  }, {\n    \"href\": \"#docs-site-setup-instructions\",\n    \"aria-label\": \"docs site setup instructions permalink\",\n    \"className\": \"anchor\"\n  }), mdx(\"svg\", _extends({\n    parentName: \"a\"\n  }, {\n    \"aria-hidden\": \"true\",\n    \"focusable\": \"false\",\n    \"height\": \"16\",\n    \"version\": \"1.1\",\n    \"viewBox\": \"0 0 16 16\",\n    \"width\": \"16\"\n  }), mdx(\"path\", _extends({\n    parentName: \"svg\"\n  }, {\n    \"fillRule\": \"evenodd\",\n    \"d\": \"M4 9h1v1H4c-1.5 0-3-1.69-3-3.5S2.55 3 4 3h4c1.45 0 3 1.69 3 3.5 0 1.41-.91 2.72-2 3.25V8.59c.58-.45 1-1.27 1-2.09C10 5.22 8.98 4 8 4H4c-.98 0-2 1.22-2 2.5S3 9 4 9zm9-3h-1v1h1c1 0 2 1.22 2 2.5S13.98 12 13 12H9c-.98 0-2-1.22-2-2.5 0-.83.42-1.64 1-2.09V6.25c-1.09.53-2 1.84-2 3.25C6 11.31 7.55 13 9 13h4c1.45 0 3-1.69 3-3.5S14.5 6 13 6z\"\n  })))), \"Docs site setup instructions\"), mdx(\"p\", null, \"After going through the development setup instructions above, there are a few additional things that are helpful to know when setting up the \", mdx(\"a\", _extends({\n    parentName: \"p\"\n  }, {\n    \"href\": \"/docs/\"\n  }), \"Gatsby.js docs site\"), \". which mostly lives in the \", mdx(\"a\", _extends({\n    parentName: \"p\"\n  }, {\n    \"href\": \"https://github.com/gatsbyjs/gatsby/tree/master/www\"\n  }), \"www\"), \" directory.\"), mdx(\"ul\", null, mdx(\"li\", {\n    parentName: \"ul\"\n  }, \"Clone the Gatsby repo as described above.\"), mdx(\"li\", {\n    parentName: \"ul\"\n  }, \"For docs-only changes, consider using \", mdx(\"inlineCode\", {\n    parentName: \"li\"\n  }, \"git checkout -b docs/some-change\"), \" or \", mdx(\"inlineCode\", {\n    parentName: \"li\"\n  }, \"git checkout -b docs-some-change\"), \", as this will short circuit the CI process and only run linting tasks.\"), mdx(\"li\", {\n    parentName: \"ul\"\n  }, \"Change directories into the docs site folder: \", mdx(\"inlineCode\", {\n    parentName: \"li\"\n  }, \"cd www\")), mdx(\"li\", {\n    parentName: \"ul\"\n  }, \"Install dependencies with Yarn: \", mdx(\"inlineCode\", {\n    parentName: \"li\"\n  }, \"yarn install\")), mdx(\"li\", {\n    parentName: \"ul\"\n  }, \"Add the following env variable to an \", mdx(\"inlineCode\", {\n    parentName: \"li\"\n  }, \".env.development\"), \" file to \", mdx(\"a\", _extends({\n    parentName: \"li\"\n  }, {\n    \"href\": \"https://github.com/gatsbyjs/gatsby/tree/master/www#running-slow-build-screenshots-placeholder\"\n  }), \"enable image placeholders\"), \": \", mdx(\"inlineCode\", {\n    parentName: \"li\"\n  }, \"GATSBY_SCREENSHOT_PLACEHOLDER=true\"), \". This will speed up building the docs site significantly!\"), mdx(\"li\", {\n    parentName: \"ul\"\n  }, \"Start a build of \", mdx(\"inlineCode\", {\n    parentName: \"li\"\n  }, \"www\"), \" with \", mdx(\"inlineCode\", {\n    parentName: \"li\"\n  }, \"gatsby develop\"), \".\"), mdx(\"li\", {\n    parentName: \"ul\"\n  }, \"Edit Markdown files in the \", mdx(\"a\", _extends({\n    parentName: \"li\"\n  }, {\n    \"href\": \"https://github.com/gatsbyjs/gatsby/tree/master/docs\"\n  }), \"docs\"), \" and \", mdx(\"a\", _extends({\n    parentName: \"li\"\n  }, {\n    \"href\": \"https://github.com/gatsbyjs/gatsby/tree/master/docs/contributing\"\n  }), \"contributing\"), \" folders, as well as the \", mdx(\"a\", _extends({\n    parentName: \"li\"\n  }, {\n    \"href\": \"https://github.com/gatsbyjs/gatsby/tree/master/www/src/data/sidebars\"\n  }), \"YAML sidebar files\"), \".\"), mdx(\"li\", {\n    parentName: \"ul\"\n  }, \"View the changes in your browser at \", mdx(\"inlineCode\", {\n    parentName: \"li\"\n  }, \"http://localhost:8000\"), \".\"), mdx(\"li\", {\n    parentName: \"ul\"\n  }, \"Commit your changes and submit a pull request!\")), mdx(\"h2\", {\n    \"id\": \"docs-renaming-instructions\"\n  }, mdx(\"a\", _extends({\n    parentName: \"h2\"\n  }, {\n    \"href\": \"#docs-renaming-instructions\",\n    \"aria-label\": \"docs renaming instructions permalink\",\n    \"className\": \"anchor\"\n  }), mdx(\"svg\", _extends({\n    parentName: \"a\"\n  }, {\n    \"aria-hidden\": \"true\",\n    \"focusable\": \"false\",\n    \"height\": \"16\",\n    \"version\": \"1.1\",\n    \"viewBox\": \"0 0 16 16\",\n    \"width\": \"16\"\n  }), mdx(\"path\", _extends({\n    parentName: \"svg\"\n  }, {\n    \"fillRule\": \"evenodd\",\n    \"d\": \"M4 9h1v1H4c-1.5 0-3-1.69-3-3.5S2.55 3 4 3h4c1.45 0 3 1.69 3 3.5 0 1.41-.91 2.72-2 3.25V8.59c.58-.45 1-1.27 1-2.09C10 5.22 8.98 4 8 4H4c-.98 0-2 1.22-2 2.5S3 9 4 9zm9-3h-1v1h1c1 0 2 1.22 2 2.5S13.98 12 13 12H9c-.98 0-2-1.22-2-2.5 0-.83.42-1.64 1-2.09V6.25c-1.09.53-2 1.84-2 3.25C6 11.31 7.55 13 9 13h4c1.45 0 3-1.69 3-3.5S14.5 6 13 6z\"\n  })))), \"Docs renaming instructions\"), mdx(\"p\", null, \"Sometimes it makes sense to move or rename a file as part of docs restructuring or for content clarification. While we recommend keeping URLs consistent as often as possible, here are some tips to minimize errors and keep the docs in a good state:\"), mdx(\"ul\", null, mdx(\"li\", {\n    parentName: \"ul\"\n  }, \"Run proposed structure changes by the Gatsby docs team in \", mdx(\"a\", _extends({\n    parentName: \"li\"\n  }, {\n    \"href\": \"/contributing/how-to-file-an-issue/\"\n  }), \"a GitHub issue\"), \" to ensure your change is accepted.\"), mdx(\"li\", {\n    parentName: \"ul\"\n  }, \"Update all instances of the old URL to your new one. \", mdx(\"a\", _extends({\n    parentName: \"li\"\n  }, {\n    \"href\": \"https://code.visualstudio.com/docs/editor/codebasics#_search-across-files\"\n  }), \"Find and replace\"), \" in VS Code can help. Check that the context of the original link reference still makes sense with the new one.\"), mdx(\"li\", {\n    parentName: \"ul\"\n  }, \"For SEO purposes, add a redirect to the \", mdx(\"inlineCode\", {\n    parentName: \"li\"\n  }, \"createPages\"), \" function in \", mdx(\"a\", _extends({\n    parentName: \"li\"\n  }, {\n    \"href\": \"https://github.com/gatsbyjs/gatsby/tree/master/www/gatsby-node.js\"\n  }), mdx(\"inlineCode\", {\n    parentName: \"a\"\n  }, \"www/gatsby-node.js\")), \". Here\\u2019s an example:\")), mdx(\"pre\", null, mdx(\"code\", _extends({\n    parentName: \"pre\"\n  }, {\n    \"className\": \"language-js:title=www/gatsby-node.js\"\n  }), \"createRedirect({\\n  fromPath: `/docs/source-plugin-tutorial/`,\\n  toPath: `/docs/pixabay-source-plugin-tutorial/`,\\n  isPermanent: true,\\n})\\n\")), mdx(\"h2\", {\n    \"id\": \"claim-your-swag\"\n  }, mdx(\"a\", _extends({\n    parentName: \"h2\"\n  }, {\n    \"href\": \"#claim-your-swag\",\n    \"aria-label\": \"claim your swag permalink\",\n    \"className\": \"anchor\"\n  }), mdx(\"svg\", _extends({\n    parentName: \"a\"\n  }, {\n    \"aria-hidden\": \"true\",\n    \"focusable\": \"false\",\n    \"height\": \"16\",\n    \"version\": \"1.1\",\n    \"viewBox\": \"0 0 16 16\",\n    \"width\": \"16\"\n  }), mdx(\"path\", _extends({\n    parentName: \"svg\"\n  }, {\n    \"fillRule\": \"evenodd\",\n    \"d\": \"M4 9h1v1H4c-1.5 0-3-1.69-3-3.5S2.55 3 4 3h4c1.45 0 3 1.69 3 3.5 0 1.41-.91 2.72-2 3.25V8.59c.58-.45 1-1.27 1-2.09C10 5.22 8.98 4 8 4H4c-.98 0-2 1.22-2 2.5S3 9 4 9zm9-3h-1v1h1c1 0 2 1.22 2 2.5S13.98 12 13 12H9c-.98 0-2-1.22-2-2.5 0-.83.42-1.64 1-2.09V6.25c-1.09.53-2 1.84-2 3.25C6 11.31 7.55 13 9 13h4c1.45 0 3-1.69 3-3.5S14.5 6 13 6z\"\n  })))), \"Claim your swag\"), mdx(\"p\", null, \"After your first code contribution to the Gatsby repo (including documentation) you become eligible for a free shirt or pair of socks. See the \", mdx(\"a\", _extends({\n    parentName: \"p\"\n  }, {\n    \"href\": \"/contributing/contributor-swag/\"\n  }), \"swag page\"), \" for more details!\"), mdx(\"h2\", {\n    \"id\": \"want-more\"\n  }, mdx(\"a\", _extends({\n    parentName: \"h2\"\n  }, {\n    \"href\": \"#want-more\",\n    \"aria-label\": \"want more permalink\",\n    \"className\": \"anchor\"\n  }), mdx(\"svg\", _extends({\n    parentName: \"a\"\n  }, {\n    \"aria-hidden\": \"true\",\n    \"focusable\": \"false\",\n    \"height\": \"16\",\n    \"version\": \"1.1\",\n    \"viewBox\": \"0 0 16 16\",\n    \"width\": \"16\"\n  }), mdx(\"path\", _extends({\n    parentName: \"svg\"\n  }, {\n    \"fillRule\": \"evenodd\",\n    \"d\": \"M4 9h1v1H4c-1.5 0-3-1.69-3-3.5S2.55 3 4 3h4c1.45 0 3 1.69 3 3.5 0 1.41-.91 2.72-2 3.25V8.59c.58-.45 1-1.27 1-2.09C10 5.22 8.98 4 8 4H4c-.98 0-2 1.22-2 2.5S3 9 4 9zm9-3h-1v1h1c1 0 2 1.22 2 2.5S13.98 12 13 12H9c-.98 0-2-1.22-2-2.5 0-.83.42-1.64 1-2.09V6.25c-1.09.53-2 1.84-2 3.25C6 11.31 7.55 13 9 13h4c1.45 0 3-1.69 3-3.5S14.5 6 13 6z\"\n  })))), \"Want more?\"), mdx(\"p\", null, \"Check out our additional pages on docs contributions:\"), mdx(\"ul\", null, mdx(\"li\", {\n    parentName: \"ul\"\n  }, mdx(\"a\", _extends({\n    parentName: \"li\"\n  }, {\n    \"href\": \"/contributing/gatsby-style-guide/\"\n  }), \"Gatsby Style Guide\")), mdx(\"li\", {\n    parentName: \"ul\"\n  }, mdx(\"a\", _extends({\n    parentName: \"li\"\n  }, {\n    \"href\": \"/contributing/docs-templates/\"\n  }), \"Docs Templates\")), mdx(\"li\", {\n    parentName: \"ul\"\n  }, mdx(\"a\", _extends({\n    parentName: \"li\"\n  }, {\n    \"href\": \"/contributing/how-to-write-a-stub/\"\n  }), \"How to Write a Stub\"))));\n}\n;\nMDXContent.isMDXComponent = true;",
        "excerpt": "Gatsby, unsurprisingly, uses Gatsby for its documentation website. Thank you in advance and cheers for contributing to Gatsby documentation…",
        "timeToRead": 4,
        "tableOfContents": {
          "items": [
            {
              "url": "#top-priorities",
              "title": "Top priorities"
            },
            {
              "url": "#options-for-contributing-to-the-gatsby-docs",
              "title": "Options for contributing to the Gatsby docs"
            },
            {
              "url": "#fixing-image-and-link-paths",
              "title": "Fixing image and link paths"
            },
            {
              "url": "#headings",
              "title": "Headings"
            },
            {
              "url": "#modifying-markdown-files",
              "title": "Modifying markdown files",
              "items": [
                {
                  "url": "#converting-a-document-from-a-stub",
                  "title": "Converting a document from a stub"
                }
              ]
            },
            {
              "url": "#docs-site-setup-instructions",
              "title": "Docs site setup instructions"
            },
            {
              "url": "#docs-renaming-instructions",
              "title": "Docs renaming instructions"
            },
            {
              "url": "#claim-your-swag",
              "title": "Claim your swag"
            },
            {
              "url": "#want-more",
              "title": "Want more?"
            }
          ]
        },
        "fields": {
          "slug": "/contributing/docs-contributions/",
          "anchor": "docs-contributions"
        },
        "frontmatter": {
          "title": "Docs Contributions",
          "overview": null,
          "issue": null,
          "disableTableOfContents": null,
          "tableOfContentsDepth": null
        },
        "parent": {
          "__typename": "File",
          "relativePath": "contributing/docs-contributions.md"
        }
      }
    },
    "pageContext": {
      "isCreatedByStatefulCreatePages": false,
      "slug": "/contributing/docs-contributions/",
      "prev": {
        "title": "Managing Pull Requests",
        "link": "/contributing/managing-pull-requests/"
      },
      "next": {
        "title": "Docs Templates",
        "link": "/contributing/docs-templates/"
      }
    }
  },
  "query": "query usersMisiekDevGatsbyWwwSrcTemplatesTemplateDocsMarkdownJs2546709735(\n  $path: String!\n) {\n  mdx(fields: {slug: {eq: $path}}) {\n    body\n    excerpt\n    timeToRead\n    tableOfContents\n    fields {\n      slug\n      anchor\n    }\n    frontmatter {\n      title\n      overview\n      issue\n      disableTableOfContents\n      tableOfContentsDepth\n    }\n    ...MarkdownPageFooterMdx\n  }\n}\n\nfragment MarkdownPageFooterMdx on Mdx {\n  parent {\n    __typename\n    ... on File {\n      relativePath\n    }\n  }\n}\n"
}