{
  "path": "/tutorial/",
  "result": {
    "data": {
      "mdx": {
        "body": "function _extends() { _extends = Object.assign || function (target) { for (var i = 1; i < arguments.length; i++) { var source = arguments[i]; for (var key in source) { if (Object.prototype.hasOwnProperty.call(source, key)) { target[key] = source[key]; } } } return target; }; return _extends.apply(this, arguments); }\n\nfunction _objectWithoutProperties(source, excluded) { if (source == null) return {}; var target = _objectWithoutPropertiesLoose(source, excluded); var key, i; if (Object.getOwnPropertySymbols) { var sourceSymbolKeys = Object.getOwnPropertySymbols(source); for (i = 0; i < sourceSymbolKeys.length; i++) { key = sourceSymbolKeys[i]; if (excluded.indexOf(key) >= 0) continue; if (!Object.prototype.propertyIsEnumerable.call(source, key)) continue; target[key] = source[key]; } } return target; }\n\nfunction _objectWithoutPropertiesLoose(source, excluded) { if (source == null) return {}; var target = {}; var sourceKeys = Object.keys(source); var key, i; for (i = 0; i < sourceKeys.length; i++) { key = sourceKeys[i]; if (excluded.indexOf(key) >= 0) continue; target[key] = source[key]; } return target; }\n\n/* @jsx mdx */\nvar _frontmatter = {\n  \"title\": \"Gatsby.js Tutorials\",\n  \"disableTableOfContents\": true\n};\n\nvar makeShortcode = function makeShortcode(name) {\n  return function MDXDefaultShortcode(props) {\n    console.warn(\"Component \" + name + \" was not imported, exported, or provided by MDXProvider as global scope\");\n    return mdx(\"div\", props);\n  };\n};\n\nvar layoutProps = {\n  _frontmatter: _frontmatter\n};\nvar MDXLayout = \"wrapper\";\nreturn function MDXContent(_ref) {\n  var components = _ref.components,\n      props = _objectWithoutProperties(_ref, [\"components\"]);\n\n  return mdx(MDXLayout, _extends({}, layoutProps, props, {\n    components: components,\n    mdxType: \"MDXLayout\"\n  }), mdx(\"p\", null, \"Welcome to Gatsby! We\\u2019re glad you\\u2019re here. The goal of this tutorial is to guide you through setting up and deploying your first Gatsby site using a starter template. As we walk through that process, we\\u2019ll introduce some more general web development topics, and go over the underlying structure of a Gatsby site.\"), mdx(\"blockquote\", null, mdx(\"p\", {\n    parentName: \"blockquote\"\n  }, \"The full tutorial is intended to be as accessible as possible to people without much web development experience (yet!) \\u2014 no need to be an expert. If you prefer to jump straight to code, feel free to skip the step-by-step tutorial and see the \", mdx(\"a\", _extends({\n    parentName: \"p\"\n  }, {\n    \"href\": \"/docs/quick-start/\"\n  }), \"quick start\"), \" page.\")), mdx(\"h2\", {\n    \"id\": \"gatsby-fundamentals\"\n  }, mdx(\"a\", _extends({\n    parentName: \"h2\"\n  }, {\n    \"href\": \"#gatsby-fundamentals\",\n    \"aria-label\": \"gatsby fundamentals permalink\",\n    \"className\": \"anchor\"\n  }), mdx(\"svg\", _extends({\n    parentName: \"a\"\n  }, {\n    \"aria-hidden\": \"true\",\n    \"focusable\": \"false\",\n    \"height\": \"16\",\n    \"version\": \"1.1\",\n    \"viewBox\": \"0 0 16 16\",\n    \"width\": \"16\"\n  }), mdx(\"path\", _extends({\n    parentName: \"svg\"\n  }, {\n    \"fillRule\": \"evenodd\",\n    \"d\": \"M4 9h1v1H4c-1.5 0-3-1.69-3-3.5S2.55 3 4 3h4c1.45 0 3 1.69 3 3.5 0 1.41-.91 2.72-2 3.25V8.59c.58-.45 1-1.27 1-2.09C10 5.22 8.98 4 8 4H4c-.98 0-2 1.22-2 2.5S3 9 4 9zm9-3h-1v1h1c1 0 2 1.22 2 2.5S13.98 12 13 12H9c-.98 0-2-1.22-2-2.5 0-.83.42-1.64 1-2.09V6.25c-1.09.53-2 1.84-2 3.25C6 11.31 7.55 13 9 13h4c1.45 0 3-1.69 3-3.5S14.5 6 13 6z\"\n  })))), \"Gatsby fundamentals\"), mdx(\"ol\", {\n    \"start\": 0\n  }, mdx(\"li\", {\n    parentName: \"ol\"\n  }, mdx(\"a\", _extends({\n    parentName: \"li\"\n  }, {\n    \"href\": \"/tutorial/part-zero/\"\n  }), \"Set Up Your Development Environment\"), \": We\\u2019ll introduce you to core technologies that power Gatsby, and guide you through setting up your development environment.\"), mdx(\"li\", {\n    parentName: \"ol\"\n  }, mdx(\"a\", _extends({\n    parentName: \"li\"\n  }, {\n    \"href\": \"/tutorial/part-one/\"\n  }), \"Get to know Gatsby building blocks\"), \": Starting new projects, developing, and deploying sites.\"), mdx(\"li\", {\n    parentName: \"ol\"\n  }, mdx(\"a\", _extends({\n    parentName: \"li\"\n  }, {\n    \"href\": \"/tutorial/part-two/\"\n  }), \"Introduction to using CSS in Gatsby\"), \": Explore libraries like Typography.js and CSS Modules.\"), mdx(\"li\", {\n    parentName: \"ol\"\n  }, mdx(\"a\", _extends({\n    parentName: \"li\"\n  }, {\n    \"href\": \"/tutorial/part-three/\"\n  }), \"Building nested layouts in Gatsby\"), \": Layouts are sections of your site that are reused across multiple pages like headers and footers.\")), mdx(\"h2\", {\n    \"id\": \"intermediate-tutorials\"\n  }, mdx(\"a\", _extends({\n    parentName: \"h2\"\n  }, {\n    \"href\": \"#intermediate-tutorials\",\n    \"aria-label\": \"intermediate tutorials permalink\",\n    \"className\": \"anchor\"\n  }), mdx(\"svg\", _extends({\n    parentName: \"a\"\n  }, {\n    \"aria-hidden\": \"true\",\n    \"focusable\": \"false\",\n    \"height\": \"16\",\n    \"version\": \"1.1\",\n    \"viewBox\": \"0 0 16 16\",\n    \"width\": \"16\"\n  }), mdx(\"path\", _extends({\n    parentName: \"svg\"\n  }, {\n    \"fillRule\": \"evenodd\",\n    \"d\": \"M4 9h1v1H4c-1.5 0-3-1.69-3-3.5S2.55 3 4 3h4c1.45 0 3 1.69 3 3.5 0 1.41-.91 2.72-2 3.25V8.59c.58-.45 1-1.27 1-2.09C10 5.22 8.98 4 8 4H4c-.98 0-2 1.22-2 2.5S3 9 4 9zm9-3h-1v1h1c1 0 2 1.22 2 2.5S13.98 12 13 12H9c-.98 0-2-1.22-2-2.5 0-.83.42-1.64 1-2.09V6.25c-1.09.53-2 1.84-2 3.25C6 11.31 7.55 13 9 13h4c1.45 0 3-1.69 3-3.5S14.5 6 13 6z\"\n  })))), \"Intermediate tutorials\"), mdx(\"p\", null, \"In these intermediate tutorials, you\\u2019ll learn how to pull data from almost anywhere into your Gatsby site with GraphQL.\"), mdx(\"ol\", {\n    \"start\": 4\n  }, mdx(\"li\", {\n    parentName: \"ol\"\n  }, mdx(\"a\", _extends({\n    parentName: \"li\"\n  }, {\n    \"href\": \"/tutorial/part-four/\"\n  }), \"Querying for data in a blog\"), \": Create a blog and use a GraphQL query to pull your site title into the blog header.\"), mdx(\"li\", {\n    parentName: \"ol\"\n  }, mdx(\"a\", _extends({\n    parentName: \"li\"\n  }, {\n    \"href\": \"/tutorial/part-five/\"\n  }), \"Source plugins and rendering queried data\"), \": Use a source plugin to pull Markdown blog posts into your site and create an index page with a list of blog posts.\"), mdx(\"li\", {\n    parentName: \"ol\"\n  }, mdx(\"a\", _extends({\n    parentName: \"li\"\n  }, {\n    \"href\": \"/tutorial/part-six/\"\n  }), \"Transformer plugins\"), \": Use a transformer plugin to transform your Markdown blog posts into a form the blog can render.\"), mdx(\"li\", {\n    parentName: \"ol\"\n  }, mdx(\"a\", _extends({\n    parentName: \"li\"\n  }, {\n    \"href\": \"/tutorial/part-seven/\"\n  }), \"Programmatically create pages from data\"), \": Learn how to programmatically create a set of pages for your blog posts.\"), mdx(\"li\", {\n    parentName: \"ol\"\n  }, mdx(\"a\", _extends({\n    parentName: \"li\"\n  }, {\n    \"href\": \"/tutorial/part-eight/\"\n  }), \"Preparing a site to go live\"), \": Learn how to audit your site for performance and best practices for accessibility, SEO, and more.\")), mdx(\"h2\", {\n    \"id\": \"theme-tutorials\"\n  }, mdx(\"a\", _extends({\n    parentName: \"h2\"\n  }, {\n    \"href\": \"#theme-tutorials\",\n    \"aria-label\": \"theme tutorials permalink\",\n    \"className\": \"anchor\"\n  }), mdx(\"svg\", _extends({\n    parentName: \"a\"\n  }, {\n    \"aria-hidden\": \"true\",\n    \"focusable\": \"false\",\n    \"height\": \"16\",\n    \"version\": \"1.1\",\n    \"viewBox\": \"0 0 16 16\",\n    \"width\": \"16\"\n  }), mdx(\"path\", _extends({\n    parentName: \"svg\"\n  }, {\n    \"fillRule\": \"evenodd\",\n    \"d\": \"M4 9h1v1H4c-1.5 0-3-1.69-3-3.5S2.55 3 4 3h4c1.45 0 3 1.69 3 3.5 0 1.41-.91 2.72-2 3.25V8.59c.58-.45 1-1.27 1-2.09C10 5.22 8.98 4 8 4H4c-.98 0-2 1.22-2 2.5S3 9 4 9zm9-3h-1v1h1c1 0 2 1.22 2 2.5S13.98 12 13 12H9c-.98 0-2-1.22-2-2.5 0-.83.42-1.64 1-2.09V6.25c-1.09.53-2 1.84-2 3.25C6 11.31 7.55 13 9 13h4c1.45 0 3-1.69 3-3.5S14.5 6 13 6z\"\n  })))), \"Theme tutorials\"), mdx(\"p\", null, \"Gatsby themes abstract all of your default configuration (shared functionality, data sourcing, design) out of your site and into an installable package.\"), mdx(\"p\", null, \"This means that the configuration and functionality isn\\u2019t directly written into your project, but rather versioned, centrally managed, and installed as a dependency. You can seamlessly update a theme, compose themes together, and even swap out one compatible theme for another.\"), mdx(\"p\", null, \"Learn more about using and building themes with the \", mdx(\"a\", _extends({\n    parentName: \"p\"\n  }, {\n    \"href\": \"/tutorial/theme-tutorials/\"\n  }), \"Gatsby theme tutorials\"), \".\"), mdx(\"h2\", {\n    \"id\": \"additional-tutorials\"\n  }, mdx(\"a\", _extends({\n    parentName: \"h2\"\n  }, {\n    \"href\": \"#additional-tutorials\",\n    \"aria-label\": \"additional tutorials permalink\",\n    \"className\": \"anchor\"\n  }), mdx(\"svg\", _extends({\n    parentName: \"a\"\n  }, {\n    \"aria-hidden\": \"true\",\n    \"focusable\": \"false\",\n    \"height\": \"16\",\n    \"version\": \"1.1\",\n    \"viewBox\": \"0 0 16 16\",\n    \"width\": \"16\"\n  }), mdx(\"path\", _extends({\n    parentName: \"svg\"\n  }, {\n    \"fillRule\": \"evenodd\",\n    \"d\": \"M4 9h1v1H4c-1.5 0-3-1.69-3-3.5S2.55 3 4 3h4c1.45 0 3 1.69 3 3.5 0 1.41-.91 2.72-2 3.25V8.59c.58-.45 1-1.27 1-2.09C10 5.22 8.98 4 8 4H4c-.98 0-2 1.22-2 2.5S3 9 4 9zm9-3h-1v1h1c1 0 2 1.22 2 2.5S13.98 12 13 12H9c-.98 0-2-1.22-2-2.5 0-.83.42-1.64 1-2.09V6.25c-1.09.53-2 1.84-2 3.25C6 11.31 7.55 13 9 13h4c1.45 0 3-1.69 3-3.5S14.5 6 13 6z\"\n  })))), \"Additional tutorials\"), mdx(\"p\", null, \"There are many use cases for Gatsby, some of which aren\\u2019t covered in the first set of tutorials to keep you focused while learning. Gatsby\\u2019s Additional Tutorials section is a collection of resources showing how to complete even more Gatsby tasks step-by-step, such as using source plugins for images and CMS content.\"), mdx(\"p\", null, \"Go deeper with \", mdx(\"a\", _extends({\n    parentName: \"p\"\n  }, {\n    \"href\": \"/tutorial/additional-tutorials/\"\n  }), \"additional Gatsby tutorials\"), \".\"));\n}\n;\nMDXContent.isMDXComponent = true;",
        "excerpt": "Welcome to Gatsby! We’re glad you’re here. The goal of this tutorial is to guide you through setting up and deploying your first Gatsby site…",
        "timeToRead": 2,
        "tableOfContents": {
          "items": [
            {
              "url": "#gatsby-fundamentals",
              "title": "Gatsby fundamentals"
            },
            {
              "url": "#intermediate-tutorials",
              "title": "Intermediate tutorials"
            },
            {
              "url": "#theme-tutorials",
              "title": "Theme tutorials"
            },
            {
              "url": "#additional-tutorials",
              "title": "Additional tutorials"
            }
          ]
        },
        "fields": {
          "slug": "/tutorial/",
          "anchor": "tutorial"
        },
        "frontmatter": {
          "title": "Gatsby.js Tutorials",
          "overview": null,
          "issue": null,
          "disableTableOfContents": true,
          "tableOfContentsDepth": null
        },
        "parent": {
          "__typename": "File",
          "relativePath": "tutorial/index.md"
        }
      }
    },
    "pageContext": {
      "isCreatedByStatefulCreatePages": false,
      "slug": "/tutorial/",
      "prev": null,
      "next": {
        "title": "0. Set Up Your Development Environment",
        "link": "/tutorial/part-zero/",
        "ui": "steps"
      }
    }
  },
  "query": "query usersMisiekDevGatsbyWwwSrcTemplatesTemplateDocsMarkdownJs2546709735(\n  $path: String!\n) {\n  mdx(fields: {slug: {eq: $path}}) {\n    body\n    excerpt\n    timeToRead\n    tableOfContents\n    fields {\n      slug\n      anchor\n    }\n    frontmatter {\n      title\n      overview\n      issue\n      disableTableOfContents\n      tableOfContentsDepth\n    }\n    ...MarkdownPageFooterMdx\n  }\n}\n\nfragment MarkdownPageFooterMdx on Mdx {\n  parent {\n    __typename\n    ... on File {\n      relativePath\n    }\n  }\n}\n"
}