{
  "path": "/docs/starters/",
  "result": {
    "data": {
      "mdx": {
        "body": "function _extends() { _extends = Object.assign || function (target) { for (var i = 1; i < arguments.length; i++) { var source = arguments[i]; for (var key in source) { if (Object.prototype.hasOwnProperty.call(source, key)) { target[key] = source[key]; } } } return target; }; return _extends.apply(this, arguments); }\n\nfunction _objectWithoutProperties(source, excluded) { if (source == null) return {}; var target = _objectWithoutPropertiesLoose(source, excluded); var key, i; if (Object.getOwnPropertySymbols) { var sourceSymbolKeys = Object.getOwnPropertySymbols(source); for (i = 0; i < sourceSymbolKeys.length; i++) { key = sourceSymbolKeys[i]; if (excluded.indexOf(key) >= 0) continue; if (!Object.prototype.propertyIsEnumerable.call(source, key)) continue; target[key] = source[key]; } } return target; }\n\nfunction _objectWithoutPropertiesLoose(source, excluded) { if (source == null) return {}; var target = {}; var sourceKeys = Object.keys(source); var key, i; for (i = 0; i < sourceKeys.length; i++) { key = sourceKeys[i]; if (excluded.indexOf(key) >= 0) continue; target[key] = source[key]; } return target; }\n\n/* @jsx mdx */\nvar _frontmatter = {\n  \"title\": \"Gatsby Starters\"\n};\n\nvar makeShortcode = function makeShortcode(name) {\n  return function MDXDefaultShortcode(props) {\n    console.warn(\"Component \" + name + \" was not imported, exported, or provided by MDXProvider as global scope\");\n    return mdx(\"div\", props);\n  };\n};\n\nvar layoutProps = {\n  _frontmatter: _frontmatter\n};\nvar MDXLayout = \"wrapper\";\nreturn function MDXContent(_ref) {\n  var components = _ref.components,\n      props = _objectWithoutProperties(_ref, [\"components\"]);\n\n  return mdx(MDXLayout, _extends({}, layoutProps, props, {\n    components: components,\n    mdxType: \"MDXLayout\"\n  }), mdx(\"p\", null, \"The Gatsby CLI tool lets you install \", mdx(\"strong\", {\n    parentName: \"p\"\n  }, \"starters\"), \", which are boilerplate Gatsby sites maintained by the community and intended for jump-starting development quickly.\"), mdx(\"h2\", {\n    \"id\": \"installing-starters\"\n  }, mdx(\"a\", _extends({\n    parentName: \"h2\"\n  }, {\n    \"href\": \"#installing-starters\",\n    \"aria-label\": \"installing starters permalink\",\n    \"className\": \"anchor\"\n  }), mdx(\"svg\", _extends({\n    parentName: \"a\"\n  }, {\n    \"aria-hidden\": \"true\",\n    \"focusable\": \"false\",\n    \"height\": \"16\",\n    \"version\": \"1.1\",\n    \"viewBox\": \"0 0 16 16\",\n    \"width\": \"16\"\n  }), mdx(\"path\", _extends({\n    parentName: \"svg\"\n  }, {\n    \"fillRule\": \"evenodd\",\n    \"d\": \"M4 9h1v1H4c-1.5 0-3-1.69-3-3.5S2.55 3 4 3h4c1.45 0 3 1.69 3 3.5 0 1.41-.91 2.72-2 3.25V8.59c.58-.45 1-1.27 1-2.09C10 5.22 8.98 4 8 4H4c-.98 0-2 1.22-2 2.5S3 9 4 9zm9-3h-1v1h1c1 0 2 1.22 2 2.5S13.98 12 13 12H9c-.98 0-2-1.22-2-2.5 0-.83.42-1.64 1-2.09V6.25c-1.09.53-2 1.84-2 3.25C6 11.31 7.55 13 9 13h4c1.45 0 3-1.69 3-3.5S14.5 6 13 6z\"\n  })))), \"Installing starters\"), mdx(\"p\", null, \"Execute the \", mdx(\"inlineCode\", {\n    parentName: \"p\"\n  }, \"gatsby new\"), \" command to clone a boilerplate starter, install its dependencies, and clear Git history.\"), mdx(\"h3\", {\n    \"id\": \"using-git-repo-urls\"\n  }, mdx(\"a\", _extends({\n    parentName: \"h3\"\n  }, {\n    \"href\": \"#using-git-repo-urls\",\n    \"aria-label\": \"using git repo urls permalink\",\n    \"className\": \"anchor\"\n  }), mdx(\"svg\", _extends({\n    parentName: \"a\"\n  }, {\n    \"aria-hidden\": \"true\",\n    \"focusable\": \"false\",\n    \"height\": \"16\",\n    \"version\": \"1.1\",\n    \"viewBox\": \"0 0 16 16\",\n    \"width\": \"16\"\n  }), mdx(\"path\", _extends({\n    parentName: \"svg\"\n  }, {\n    \"fillRule\": \"evenodd\",\n    \"d\": \"M4 9h1v1H4c-1.5 0-3-1.69-3-3.5S2.55 3 4 3h4c1.45 0 3 1.69 3 3.5 0 1.41-.91 2.72-2 3.25V8.59c.58-.45 1-1.27 1-2.09C10 5.22 8.98 4 8 4H4c-.98 0-2 1.22-2 2.5S3 9 4 9zm9-3h-1v1h1c1 0 2 1.22 2 2.5S13.98 12 13 12H9c-.98 0-2-1.22-2-2.5 0-.83.42-1.64 1-2.09V6.25c-1.09.53-2 1.84-2 3.25C6 11.31 7.55 13 9 13h4c1.45 0 3-1.69 3-3.5S14.5 6 13 6z\"\n  })))), \"Using Git repo URLs\"), mdx(\"p\", null, \"When creating a new Gatsby site, you can optionally specify a starter to base your new site on; they can come from any publicly available Git repo, such as GitHub, GitLab, or Bitbucket. You can supply the \", mdx(\"inlineCode\", {\n    parentName: \"p\"\n  }, \"[URL_OF_STARTER_GIT_REPO]\"), \" directly:\"), mdx(\"pre\", null, mdx(\"code\", _extends({\n    parentName: \"pre\"\n  }, {\n    \"className\": \"language-shell\"\n  }), \"gatsby new [SITE_DIRECTORY] [URL_OF_STARTER_GIT_REPO]\\n\")), mdx(\"p\", null, \"For example, to create a site in a \", mdx(\"inlineCode\", {\n    parentName: \"p\"\n  }, \"blog\"), \" directory with Gatsby Starter Blog from its GitHub URL:\"), mdx(\"pre\", null, mdx(\"code\", _extends({\n    parentName: \"pre\"\n  }, {\n    \"className\": \"language-shell\"\n  }), \"gatsby new blog https://github.com/gatsbyjs/gatsby-starter-blog\\n\")), mdx(\"p\", null, \"This downloads the files and initializes the site by running \", mdx(\"inlineCode\", {\n    parentName: \"p\"\n  }, \"npm install\"), \".\"), mdx(\"h3\", {\n    \"id\": \"using-github-usernames-and-repos-instead-of-urls\"\n  }, mdx(\"a\", _extends({\n    parentName: \"h3\"\n  }, {\n    \"href\": \"#using-github-usernames-and-repos-instead-of-urls\",\n    \"aria-label\": \"using github usernames and repos instead of urls permalink\",\n    \"className\": \"anchor\"\n  }), mdx(\"svg\", _extends({\n    parentName: \"a\"\n  }, {\n    \"aria-hidden\": \"true\",\n    \"focusable\": \"false\",\n    \"height\": \"16\",\n    \"version\": \"1.1\",\n    \"viewBox\": \"0 0 16 16\",\n    \"width\": \"16\"\n  }), mdx(\"path\", _extends({\n    parentName: \"svg\"\n  }, {\n    \"fillRule\": \"evenodd\",\n    \"d\": \"M4 9h1v1H4c-1.5 0-3-1.69-3-3.5S2.55 3 4 3h4c1.45 0 3 1.69 3 3.5 0 1.41-.91 2.72-2 3.25V8.59c.58-.45 1-1.27 1-2.09C10 5.22 8.98 4 8 4H4c-.98 0-2 1.22-2 2.5S3 9 4 9zm9-3h-1v1h1c1 0 2 1.22 2 2.5S13.98 12 13 12H9c-.98 0-2-1.22-2-2.5 0-.83.42-1.64 1-2.09V6.25c-1.09.53-2 1.84-2 3.25C6 11.31 7.55 13 9 13h4c1.45 0 3-1.69 3-3.5S14.5 6 13 6z\"\n  })))), \"Using GitHub usernames and repos instead of URLs\"), mdx(\"p\", null, \"Alternatively, you can also supply a GitHub user name and repository:\"), mdx(\"pre\", null, mdx(\"code\", _extends({\n    parentName: \"pre\"\n  }, {\n    \"className\": \"language-shell\"\n  }), \"gatsby new [SITE_DIRECTORY] [GITHUB_USER_NAME/REPO]\\n\")), mdx(\"p\", null, \"Here is an example with the \", mdx(\"inlineCode\", {\n    parentName: \"p\"\n  }, \"[GITHUB_USER_NAME/REPO]\"), \" format:\"), mdx(\"pre\", null, mdx(\"code\", _extends({\n    parentName: \"pre\"\n  }, {\n    \"className\": \"language-shell\"\n  }), \"gatsby new blog gatsbyjs/gatsby-starter-blog\\n\")), mdx(\"p\", null, \"This also downloads the files and initializes the site by running \", mdx(\"inlineCode\", {\n    parentName: \"p\"\n  }, \"npm install\"), \".\"), mdx(\"p\", null, \"If you don\\u2019t specify a custom starter, your site will be created from the \", mdx(\"a\", _extends({\n    parentName: \"p\"\n  }, {\n    \"href\": \"https://github.com/gatsbyjs/gatsby-starter-default\"\n  }), \"default starter\"), \".\"), mdx(\"blockquote\", null, mdx(\"p\", {\n    parentName: \"blockquote\"\n  }, mdx(\"strong\", {\n    parentName: \"p\"\n  }, \"Note:\"), \" If you work for an Enterprise-level company where you are unable to pull from public GitHub repositories, you can still set up Gatsby. Check out the \", mdx(\"a\", _extends({\n    parentName: \"p\"\n  }, {\n    \"href\": \"/docs/setting-up-gatsby-without-gatsby-new/\"\n  }), \"docs to learn more\"), \".\")), mdx(\"h3\", {\n    \"id\": \"using-a-local-starter\"\n  }, mdx(\"a\", _extends({\n    parentName: \"h3\"\n  }, {\n    \"href\": \"#using-a-local-starter\",\n    \"aria-label\": \"using a local starter permalink\",\n    \"className\": \"anchor\"\n  }), mdx(\"svg\", _extends({\n    parentName: \"a\"\n  }, {\n    \"aria-hidden\": \"true\",\n    \"focusable\": \"false\",\n    \"height\": \"16\",\n    \"version\": \"1.1\",\n    \"viewBox\": \"0 0 16 16\",\n    \"width\": \"16\"\n  }), mdx(\"path\", _extends({\n    parentName: \"svg\"\n  }, {\n    \"fillRule\": \"evenodd\",\n    \"d\": \"M4 9h1v1H4c-1.5 0-3-1.69-3-3.5S2.55 3 4 3h4c1.45 0 3 1.69 3 3.5 0 1.41-.91 2.72-2 3.25V8.59c.58-.45 1-1.27 1-2.09C10 5.22 8.98 4 8 4H4c-.98 0-2 1.22-2 2.5S3 9 4 9zm9-3h-1v1h1c1 0 2 1.22 2 2.5S13.98 12 13 12H9c-.98 0-2-1.22-2-2.5 0-.83.42-1.64 1-2.09V6.25c-1.09.53-2 1.84-2 3.25C6 11.31 7.55 13 9 13h4c1.45 0 3-1.69 3-3.5S14.5 6 13 6z\"\n  })))), \"Using a local starter\"), mdx(\"p\", null, \"Another option is to supply a path (relative or absolute) to a local folder containing a starter:\"), mdx(\"pre\", null, mdx(\"code\", _extends({\n    parentName: \"pre\"\n  }, {\n    \"className\": \"language-shell\"\n  }), \"gatsby new [SITE_DIRECTORY] [LOCAL_PATH_TO_STARTER]\\n\")), mdx(\"p\", null, \"Here is an example assuming a starter exists on the path \", mdx(\"inlineCode\", {\n    parentName: \"p\"\n  }, \"Code/my-local-starter\"), \":\"), mdx(\"pre\", null, mdx(\"code\", _extends({\n    parentName: \"pre\"\n  }, {\n    \"className\": \"language-shell\"\n  }), \"gatsby new blog Code/my-local-starter\\n\")), mdx(\"h2\", {\n    \"id\": \"official-starters\"\n  }, mdx(\"a\", _extends({\n    parentName: \"h2\"\n  }, {\n    \"href\": \"#official-starters\",\n    \"aria-label\": \"official starters permalink\",\n    \"className\": \"anchor\"\n  }), mdx(\"svg\", _extends({\n    parentName: \"a\"\n  }, {\n    \"aria-hidden\": \"true\",\n    \"focusable\": \"false\",\n    \"height\": \"16\",\n    \"version\": \"1.1\",\n    \"viewBox\": \"0 0 16 16\",\n    \"width\": \"16\"\n  }), mdx(\"path\", _extends({\n    parentName: \"svg\"\n  }, {\n    \"fillRule\": \"evenodd\",\n    \"d\": \"M4 9h1v1H4c-1.5 0-3-1.69-3-3.5S2.55 3 4 3h4c1.45 0 3 1.69 3 3.5 0 1.41-.91 2.72-2 3.25V8.59c.58-.45 1-1.27 1-2.09C10 5.22 8.98 4 8 4H4c-.98 0-2 1.22-2 2.5S3 9 4 9zm9-3h-1v1h1c1 0 2 1.22 2 2.5S13.98 12 13 12H9c-.98 0-2-1.22-2-2.5 0-.83.42-1.64 1-2.09V6.25c-1.09.53-2 1.84-2 3.25C6 11.31 7.55 13 9 13h4c1.45 0 3-1.69 3-3.5S14.5 6 13 6z\"\n  })))), \"Official starters\"), mdx(\"p\", null, \"Official starters are maintained by Gatsby.\"), mdx(\"table\", null, mdx(\"thead\", {\n    parentName: \"table\"\n  }, mdx(\"tr\", {\n    parentName: \"thead\"\n  }, mdx(\"th\", _extends({\n    parentName: \"tr\"\n  }, {\n    \"align\": null\n  }), \"Starter\"), mdx(\"th\", _extends({\n    parentName: \"tr\"\n  }, {\n    \"align\": null\n  }), \"Demo\"), mdx(\"th\", _extends({\n    parentName: \"tr\"\n  }, {\n    \"align\": null\n  }), \"Use case\"), mdx(\"th\", _extends({\n    parentName: \"tr\"\n  }, {\n    \"align\": null\n  }), \"Features\"))), mdx(\"tbody\", {\n    parentName: \"table\"\n  }, mdx(\"tr\", {\n    parentName: \"tbody\"\n  }, mdx(\"td\", _extends({\n    parentName: \"tr\"\n  }, {\n    \"align\": null\n  }), mdx(\"a\", _extends({\n    parentName: \"td\"\n  }, {\n    \"href\": \"https://github.com/gatsbyjs/gatsby-starter-default\"\n  }), \"gatsby-starter-default\")), mdx(\"td\", _extends({\n    parentName: \"tr\"\n  }, {\n    \"align\": null\n  }), mdx(\"a\", _extends({\n    parentName: \"td\"\n  }, {\n    \"href\": \"https://gatsby-starter-default-demo.netlify.com/\"\n  }), \"Demo\")), mdx(\"td\", _extends({\n    parentName: \"tr\"\n  }, {\n    \"align\": null\n  }), \"Appropriate for most use cases\"), mdx(\"td\", _extends({\n    parentName: \"tr\"\n  }, {\n    \"align\": null\n  }), \"General Gatsby site\")), mdx(\"tr\", {\n    parentName: \"tbody\"\n  }, mdx(\"td\", _extends({\n    parentName: \"tr\"\n  }, {\n    \"align\": null\n  }), mdx(\"a\", _extends({\n    parentName: \"td\"\n  }, {\n    \"href\": \"https://github.com/gatsbyjs/gatsby-starter-blog\"\n  }), \"gatsby-starter-blog\")), mdx(\"td\", _extends({\n    parentName: \"tr\"\n  }, {\n    \"align\": null\n  }), mdx(\"a\", _extends({\n    parentName: \"td\"\n  }, {\n    \"href\": \"https://gatsby-starter-blog-demo.netlify.com/\"\n  }), \"Demo\")), mdx(\"td\", _extends({\n    parentName: \"tr\"\n  }, {\n    \"align\": null\n  }), \"Create a basic blog\"), mdx(\"td\", _extends({\n    parentName: \"tr\"\n  }, {\n    \"align\": null\n  }), \"Blog post pages and listings\")), mdx(\"tr\", {\n    parentName: \"tbody\"\n  }, mdx(\"td\", _extends({\n    parentName: \"tr\"\n  }, {\n    \"align\": null\n  }), mdx(\"a\", _extends({\n    parentName: \"td\"\n  }, {\n    \"href\": \"https://github.com/gatsbyjs/gatsby-starter-hello-world\"\n  }), \"gatsby-starter-hello-world\")), mdx(\"td\", _extends({\n    parentName: \"tr\"\n  }, {\n    \"align\": null\n  }), mdx(\"a\", _extends({\n    parentName: \"td\"\n  }, {\n    \"href\": \"https://gatsby-starter-hello-world-demo.netlify.com/\"\n  }), \"Demo\")), mdx(\"td\", _extends({\n    parentName: \"tr\"\n  }, {\n    \"align\": null\n  }), \"Learn Gatsby\"), mdx(\"td\", _extends({\n    parentName: \"tr\"\n  }, {\n    \"align\": null\n  }), \"Gatsby bare essentials\")))), mdx(\"h2\", {\n    \"id\": \"making-starters\"\n  }, mdx(\"a\", _extends({\n    parentName: \"h2\"\n  }, {\n    \"href\": \"#making-starters\",\n    \"aria-label\": \"making starters permalink\",\n    \"className\": \"anchor\"\n  }), mdx(\"svg\", _extends({\n    parentName: \"a\"\n  }, {\n    \"aria-hidden\": \"true\",\n    \"focusable\": \"false\",\n    \"height\": \"16\",\n    \"version\": \"1.1\",\n    \"viewBox\": \"0 0 16 16\",\n    \"width\": \"16\"\n  }), mdx(\"path\", _extends({\n    parentName: \"svg\"\n  }, {\n    \"fillRule\": \"evenodd\",\n    \"d\": \"M4 9h1v1H4c-1.5 0-3-1.69-3-3.5S2.55 3 4 3h4c1.45 0 3 1.69 3 3.5 0 1.41-.91 2.72-2 3.25V8.59c.58-.45 1-1.27 1-2.09C10 5.22 8.98 4 8 4H4c-.98 0-2 1.22-2 2.5S3 9 4 9zm9-3h-1v1h1c1 0 2 1.22 2 2.5S13.98 12 13 12H9c-.98 0-2-1.22-2-2.5 0-.83.42-1.64 1-2.09V6.25c-1.09.53-2 1.84-2 3.25C6 11.31 7.55 13 9 13h4c1.45 0 3-1.69 3-3.5S14.5 6 13 6z\"\n  })))), \"Making starters\"), mdx(\"p\", null, \"Learn \", mdx(\"a\", _extends({\n    parentName: \"p\"\n  }, {\n    \"href\": \"/docs/creating-a-starter/\"\n  }), \"how to make a starter\"), \" in the Gatsby docs. Starters can be created for your team(s) only or distributed to the broader community. It\\u2019s up to you!\"), mdx(\"h2\", {\n    \"id\": \"community-starters\"\n  }, mdx(\"a\", _extends({\n    parentName: \"h2\"\n  }, {\n    \"href\": \"#community-starters\",\n    \"aria-label\": \"community starters permalink\",\n    \"className\": \"anchor\"\n  }), mdx(\"svg\", _extends({\n    parentName: \"a\"\n  }, {\n    \"aria-hidden\": \"true\",\n    \"focusable\": \"false\",\n    \"height\": \"16\",\n    \"version\": \"1.1\",\n    \"viewBox\": \"0 0 16 16\",\n    \"width\": \"16\"\n  }), mdx(\"path\", _extends({\n    parentName: \"svg\"\n  }, {\n    \"fillRule\": \"evenodd\",\n    \"d\": \"M4 9h1v1H4c-1.5 0-3-1.69-3-3.5S2.55 3 4 3h4c1.45 0 3 1.69 3 3.5 0 1.41-.91 2.72-2 3.25V8.59c.58-.45 1-1.27 1-2.09C10 5.22 8.98 4 8 4H4c-.98 0-2 1.22-2 2.5S3 9 4 9zm9-3h-1v1h1c1 0 2 1.22 2 2.5S13.98 12 13 12H9c-.98 0-2-1.22-2-2.5 0-.83.42-1.64 1-2.09V6.25c-1.09.53-2 1.84-2 3.25C6 11.31 7.55 13 9 13h4c1.45 0 3-1.69 3-3.5S14.5 6 13 6z\"\n  })))), \"Community starters\"), mdx(\"p\", null, \"Community starters are created and maintained by Gatsby community members.\"), mdx(\"ul\", null, mdx(\"li\", {\n    parentName: \"ul\"\n  }, \"Looking for a starter for a particular use case? Browse starters that have been submitted to the \", mdx(\"a\", _extends({\n    parentName: \"li\"\n  }, {\n    \"href\": \"/starters/\"\n  }), \"Starter Library\"), \".\"), mdx(\"li\", {\n    parentName: \"ul\"\n  }, \"Created a starter you\\u2019d like to share? Follow \", mdx(\"a\", _extends({\n    parentName: \"li\"\n  }, {\n    \"href\": \"/contributing/submit-to-starter-library/\"\n  }), \"these steps to submit your starter\"), \" to the Starter Library.\")));\n}\n;\nMDXContent.isMDXComponent = true;",
        "excerpt": "The Gatsby CLI tool lets you install  starters , which are boilerplate Gatsby sites maintained by the community and intended for jump…",
        "timeToRead": 1,
        "tableOfContents": {
          "items": [
            {
              "url": "#installing-starters",
              "title": "Installing starters",
              "items": [
                {
                  "url": "#using-git-repo-urls",
                  "title": "Using Git repo URLs"
                },
                {
                  "url": "#using-github-usernames-and-repos-instead-of-urls",
                  "title": "Using GitHub usernames and repos instead of URLs"
                },
                {
                  "url": "#using-a-local-starter",
                  "title": "Using a local starter"
                }
              ]
            },
            {
              "url": "#official-starters",
              "title": "Official starters"
            },
            {
              "url": "#making-starters",
              "title": "Making starters"
            },
            {
              "url": "#community-starters",
              "title": "Community starters"
            }
          ]
        },
        "fields": {
          "slug": "/docs/starters/",
          "anchor": "starters"
        },
        "frontmatter": {
          "title": "Gatsby Starters",
          "overview": null,
          "issue": null,
          "disableTableOfContents": null,
          "tableOfContentsDepth": null
        },
        "parent": {
          "__typename": "File",
          "relativePath": "docs/starters.md"
        }
      }
    },
    "pageContext": {
      "isCreatedByStatefulCreatePages": false,
      "slug": "/docs/starters/",
      "prev": {
        "title": "Maintaining a Plugin*",
        "link": "/docs/maintaining-a-plugin/"
      },
      "next": {
        "title": "Starter Library",
        "link": "/starters/"
      }
    }
  },
  "query": "query usersMisiekDevGatsbyWwwSrcTemplatesTemplateDocsMarkdownJs2546709735(\n  $path: String!\n) {\n  mdx(fields: {slug: {eq: $path}}) {\n    body\n    excerpt\n    timeToRead\n    tableOfContents\n    fields {\n      slug\n      anchor\n    }\n    frontmatter {\n      title\n      overview\n      issue\n      disableTableOfContents\n      tableOfContentsDepth\n    }\n    ...MarkdownPageFooterMdx\n  }\n}\n\nfragment MarkdownPageFooterMdx on Mdx {\n  parent {\n    __typename\n    ... on File {\n      relativePath\n    }\n  }\n}\n"
}